key,value,label,emerlabel,version,sent1,num
topic3,1.157864,bring back; subscription list; get stick,0,11.38,1: every_time_i want_to_watch a_video the ad load perfectly but not the_actual video if i_want_to watch the_actual video i would have to wait_for about a minute just so it could start and_then it'll buffer until it finish;<br>2: youtube have always be a_great application for watch video until a_few update_ago about <digit> minute into the video the footage would start again but the audio would countinue;<br>3: i_want_to be_able_to watch video again bc thats the_whole point;<br>,4
topic3,1.596210,multiple time; pause button; social medium,0,11.39,1: youtube have stop play video_will_load up a blank or normal video screen will download the video but will_not_play no_matter_what i do io_10 i suspect;<br>2: i_can skip further into the video but it_still_won't play no_matter_what i do;<br>3: please_make it so the screen doesn't time put while_i'm watch video it's_very_annoy to have to touch my_screen especially when watch long video or music video;<br>,5
topic3,1.164896,channel art; home button; offline mode,0,11.41,1: please_fix it so when_i click a youtube link_in the description_of a_video it_take me straight to that video instead_of the internal browser safari open youtube;<br>2: when_i restart_my_device i almost have a dead blue screen;<br>3: hi youtube i be try_to change_my channel_art but i_could not for_some_reason the internet be work all fine and everything but every_time_i try it just_say try_again_later;<br>,6
topic3,1.609600,landscape mode; multiple time; download quality,0,11.43,1: when_i try_to load a_video if freeze and won't_play_anything they definitely need_to_fix it;<br>2: when_i try_to watch_a video the ad freeze and don't_play so i_can never get past them;<br>3: it's also glitchy and slow when_i try_to minimize a_video or even pause the video while in_full_screen;<br>,7
topic3,1.553263,portrait mode; sub box; wifi connection,0,11.45,1: when_i go_to click_on_a video it just_keep on load until it_say unable_to_play video and keep loop;<br>2: when_i click_on_a video to_watch it do_not load;<br>3: when_i click_on the video the add play then there_be_a black_screen_with a circle load sign then it just_say cannot_play video;<br>,8
topic3,2.271425,relate video; wont work; wrong tap,0,11.47,1: whenever_i click a_video on the watch next tab the_app crash <digit>;<br>2: whenever_you click_on_a video on the side while a_video be already open the_app crash;<br>3: ever_since_the new_update the_app crash whenever_i_try to click a_new video on the side while_watch a_video;<br>,9
topic3,2.054269,scrub bar; audio keep; keep get,0,11.47.1,1: every now and_then a_video will_just_freeze while the audio_keep play or when_i try_to go_to a_certain part_of the video use the scrub_bar it just go_to the exact same part_of the video no_matter_where on the scrub_bar i release;<br>2: when_i press_on a_video once_in a_while the video won't_even load and if i tap_to_retry again it will just_tell_me again;<br>3: i like the_app but when_i try_to watch_a video it won't_work;<br>,10
topic3,2.453588,play button; full screen; fix something,0,11.49,1: despite <digit> 10_time have <digit> wifi bar i_can hardly watch_a video whenever_i_press a_video it_say no_connection at_the_bottom and when_i do find a_video it buffer immediately;<br>2: then when_i pause a_video for_about 2_minute when_i have to do_something when_i try_to play it again the play_button stall for_about a minute_or <digit> then start play or doesn't start play_at_all fix pls;<br>3: whenever_i_try to_watch a_video it_say_error tap_again to_retry and when_i tap it it_say the_same_thing over and over;<br>,11
topic3,1.047020,nothing happen; subscription fee; rewind button,0,12.03,1: ugh when_i click my_screen it skip like 30_second ahead in the video and_then when_i go_back it ether go_back_to much or no where near enough youtube stop ok just_stop make it in the corner or_something but don't make it if_you touch anything on your screen it skip because i will accidentally tap my_screen and_then it will take_me like 5_minute to get back_to the part_of the video i be at before just fix_this it's_annoy;<br>2: the recently implement feature which make it that if the side_of_the screen be tap the video either fast_forward_or rewinds be extremely_annoy as it cause many accidental time skip;<br>3: whenever_you click_on_a video it_say_something go_wrong click to_retry i've tap a dozen time and nothing_happen;<br>,12
topic3,1.659025,wrong tap; ten second; wanna watch,0,12.04,1: ever_since_the new_update i would click_on_a video to_watch and it would load for <digit> second_then tell_me_something_go wrong_tap it again and when_i tap it the_same_thing pop_up and even_when you go_on a_different video it pop_up again fix_it please;<br>2: i will click a_video then the video will skip the add then the video will say_something_go_wrong tap_to_try_again then i tap and it_say the_same_thing;<br>3: when_i click_on the video it_say video unavailable;<br>,13
topic3,1.262521,nothing happen; something's wrong; keep show,0,12.05,1: now every_time_i try_to open the_app it go vertical and it completely freeze i_can't do_anything;<br>2: every_time_i try_to watch_a video it crash i've bin board out_of_my mind for so_long i'm canadian i_can't go out side;<br>3: every_time_i open the_app and load a_video it freeze;<br>,14
topic3,1.250536,watch anything; nothing happen; side bar,0,12.06,1: video arent load and when_i go_to open a description the_app crash;<br>2: the_app open and load the thumbnail half the time and when_you try_to watch_a video it won't_load but it will_load the ad for it;<br>3: it log_me out when_i first open the_app after the update and every_time_i try_to log_in it_keep_say there's_an_error at this time;<br>,15
topic3,2.293683,black screen; screen mode; get notification,0,12.07,1: every_time_i try_to watch_a video it_say_something go_wrong;<br>2: every_time_i go_to watch_a video it_say_something go_wrong_tap_to retry;<br>3: something_go_wrong_tap to_retry that's what it_say every_time_i try_to watch_a video fix_this;<br>,16
topic3,1.110372,full screen; main thing; home button,0,12.09,1: every_time_i try_to watch_a video it_say that an_error_occur;<br>2: every_time_i try_to watch_a video it just do_not_work please_fix_this;<br>3: latest_update cause youtube to crash when click_on video on_facebook;<br>,17
topic3,2.315265,try reinstall; error message; keep say,0,12.10,1: when_i press a_video be say_something_go_wrong tap_to_retry so i tap and it play for_about 20_second before the message_come_up again;<br>2: keep_say that when_i try_to watch_a video;<br>3: when_i try_to watch_a video it_say_something go_wrong_tap_to retry i have try_reinstall the_app and it_still_doesn't work;<br>,18
topic3,1.546818,stupid message; nothing happen; keep write,0,12.11,1: everytime_i try_to watch_a video on the_app or safari it_keep_say something_go_wrong please_try_again fix_it;<br>2: every_time_i open a_video it_say_something go_wrong_try_again;<br>3: when_i go_to click_on_a video it keep_tell_me something_go_wrong;<br>,19
topic4,1.556543,keep crash; get stick; long time,0,11.30,1: that one glitch that really_annoy_me last_update will be go but a whole slew of new issue will arise;<br>2: that one glitch that really_annoy_me last_update will be go but s whole slew of new issue will arise;<br>3: on most video i watch the audio be out_of_sync and the description be completely go and sometimes the comment be go as_well please_fix so buggy;<br>,1
topic4,1.599742,make sense; billion dollar; web browser,0,11.34,1: it's so weird and hard_to use pls_fix it ffs;<br>2: bring_back_the old style it's very hard_to use;<br>3: youtube use to be some where that you_could express your self freely;<br>,2
topic4,2.732430,full screen; relate video; comment section,0,11.35,1: either add a back_button or allow swipe from the leave edge to retrace your step without have to go all the way into the view history;<br>2: glitch_where you_can not exit a_video to the channel screen without forcefully close app <digit>;<br>3: you shouldve leave it as the_old_version and just add the dislike button;<br>,3
topic4,1.223582,get stick; bring back; bug fix,0,11.38,1: it happen since_yesterday and it work at time but most_of_the time it_doesn't play anything please_fix it;<br>2: youtube please_fix you_guy actually listen_to review;<br>3: if it hasn't happen to you it probably won't know it;<br>,4
topic4,0.996984,slide bar; rewind button; social medium,0,11.39,1: i_can then reply_to your reply from my_first reply_to your reply and_then you_can re_reply so i_can re_reply to your re replay and_then we_can become life time friend because we_have reply and re_reply all_day long;<br>2: i_can_only give it one_star because i_can't reply_to reply_to a reply_to a reply_to a reply_to a reply or even_worse still i_can't reply_to a re_reply;<br>3: sorry no time i get to reply_to a reply;<br>,5
topic4,1.483623,ipad air; find anything; offline mode,0,11.41,1: it be happen more regularly please_fix it it_seem like it be an_issue for many other_user too;<br>2: the link not open for the description please_fix that quickly;<br>3: when_i search stuff and more and more it's_annoy it stay_there and i wanna get it remove private stuff i do but i don't_want anyone to_see it you know_what i mean;<br>,6
topic4,1.189723,next time; slide bar; rewind button,0,11.43,1: my_phone get really hot when use the youtube app;<br>2: so disappoint the_new_update make it that the video_won't_play at_all so now i delete it and be hop that it'll get fix next_time i get it;<br>3: this be the worst_update youtube be really_slow and complicate and i_can't use it please_get_rid of the_new_update;<br>,7
topic4,2.167974,top comment; playback error; keep get,0,11.45,1: whenever_i wanna look_at top_comment it either show new comment or one top_comment follow by a_new comment i wanna look_at all the_top comment and not new comment please_fix;<br>2: i've have the_app for a_long_time and it have never do this before whenever_i won't to_watch a_video it will_load the thumbnail but then won't_play this_bug happen a_lot so could u please_fix it;<br>3: can_you please_fix it_asap and i mean asap;<br>,8
topic4,1.934621,double tap; skip forward; scrub bar,0,11.47,1: the other vids on the side_of_the screen be go;<br>2: you_guy need_to remove the button altogether or locate them somewhere other_than the screen;<br>3: and the double_tap on one side to skip_back or foward during a_video be really really_annoy;<br>,9
topic4,1.575086,wont work; cellular network; data usage,0,11.47.1,1: i use this all the time but something happen whenever_i touch the screen twice it skip_10_second and because_of that it spoil something that be go_to happen in a_video i have an addiction to repeatedly tap my_screen so this be awful why_do_you add this;<br>2: in the time i've use this_app there have be countless update and yet the bug persist;<br>3: <digit> sec all the time cant use youtube anymore;<br>,10
topic4,2.037699,keep press; grey screen; make sense,0,11.49,1: i_want_to use the_app but i_can't because you aren't let_me;<br>2: i_can't_watch a_video without a_message_come up say_something_go_wrong this isn't acceptable youtube if_you want anyone to use your_app just_say shouldn't happen;<br>3: my_friend have the_same phone as me but the have a newer youtube layout but i_can't get it it's stupid;<br>,11
topic4,1.774012,double tap; skip thing; rewind button,0,12.03,1: the control be clunky and hard_to use;<br>2: it use to be easy control buffer bar;<br>3: why be the onscreen control layout so obscure and difficult_to use;<br>,12
topic4,1.638739,grey screen; slide bar; important thing,0,12.04,1: fix_your stupid issue_with youtube i_can listen_to youtube on_my_ipod no_problem but the minute i_try to play something on_my_iphone then it_doesn't_work and i get the stupid something_go_wrong grey_screen and_it's_really annoy my_ipod isn't eligible for io_10 so it's under that version but my_phone be up to date;<br>2: the slide_bar thing be hard_to control screw the 10_second_skip and rewind;<br>3: please_fix as it be get_really_annoy;<br>,13
topic4,1.689404,double tap; last time; single video,0,12.05,1: i use to spend lot_of time on youtube but with the_new_update i_can't log_into my_account when_i do try_to log_in it express an_error that i do_not know_how to fix;<br>2: i just get the_latest_update on_my_iphone 7s with plenty of space leave and glitching and buffer i use to read the review and not care until i get this update this be a_good app just don't get the_latest_version you will definitely regret it;<br>3: i_can't get a_single_video to play after the_last_update;<br>,14
topic4,2.275216,terrible layout; spring day; double tap,0,12.06,1: i use to have an old_version_of youtube and i recently update now i_can't listen_to any_video if i turn_off my_device this render the youtube app useless to me;<br>2: i_can't use it anymore the update screw it up;<br>3: won't be bother use the_app until you start give a_damn about your audience again;<br>,15
topic4,1.967526,subscribe channel; get notification; double tap,0,12.07,1: plus this be the second time this have happen;<br>2: i've restart device i've_delete apps but it still do it;<br>3: unwanted reccomendations still appear when_i open youtube app;<br>,16
topic4,2.046372,skip forward; lgbt community; chrome cast,0,12.09,1: and now i_can't use the_app at_all;<br>2: i use to love_this app but not i_can't stand it;<br>3: i like the new youtube update with the 10_second thing but their be one_thing you mess_up on i_can't pause and in pause with the click of my earphone button i_know i sound really lazy but i'm just so use to click my earphone button because it's_really handy and quick and i don't have to worry_about miss out on anything when something or someone interrupt me while_i'm watch_a youtube video;<br>,17
topic4,1.521780,double tap; ipad mini; pause button,0,12.10,1: use iphone_6s fully up to date;<br>2: have the button in a spot where_you consistently bump it and to not have the option whether you choose to connect_to the tv be a_huge pain;<br>3: i_know advertisement be important for your business but why_can't you just add a 5_second_skip button to every ad and not put an_ad_at every_single_video;<br>,18
topic4,1.514886,web browser; keep crash; comment section,0,12.11,1: <digit> of the time i_click_on a_video it's crash the_app plus there's so_much ad i_don't_know if that's the publisher ad or youtubes ad please_fix i'm get tire_of this;<br>2: you_could click retry a million time and it_doesn't_work;<br>3: lot_of crash like and dislike won't_show a_lot_of the time and comment_section a_lot_of the time doesn't_show;<br>,19
topic5,1.337317,cellular network; audio keep; keep crash,keep get; background play; web browser,11.30,1: every_video i watch will_play for like <digit> second and it will buffer for almost <digit> minute before it play for_a_few second;<br>2: it will basically act_like it's go_to play but then act_like it's freeze or_something and won't_even get past the first second_of the ad or video;<br>3: no video be play anymore and i keep_get the message_something_go wrong;<br>,1
topic5,1.319624,wifi connection; last time; make sense,0,11.34,1: load slow_down much compare to last_time even be on strong wifi_connection;<br>2: even on a strong and fast wifi_connection it have problem load video however on the mobile site it be ok;<br>3: hi my name be ms yvettemarie and when make my review i'm go_to be_honest and upfront cause that's what i do always honest with people yeah tell em straight me best way_to be i_reckon and the truth be i_reckon youtube be pretty slack because when_i try_to load a_video it_take a_good 10_minute to load and i_reckon it can't be issue_with my_wifi because i always_have sufficient wifi and so i'm guess the issue must_be on youtube's side which_be a_bite unfortunate because youtube as a very proud very strong black woman who descend from be part aboriginal malaysian and although very proud of my malay heritage i identify as be aboriginal very proud of my race and where i come_from and i only access your channel to educate myself on my wonderful history and culture of indigenous australia but i have to say i'm quite disappoint when your video take_forever_to load and so i would please ask that you rectify any issue you may_be encounter on your end thank so_much and overall i_reckon your_app be marvellous despite the problem i encounter try_to get the video to load so good one thank guy;<br>,2
topic5,1.663061,fix something; main thing; subscription fee,0,11.35,1: well the update do_not completely destroy the_app but what can a ralph do to a perfectly well_do build besides end_up destroy it;<br>2: put it back_to how it be and fix these bug;<br>3: my point be please get felix to destroy the bug before it_take over the_entire sugar rush;<br>,3
topic5,1.318091,take age; get stick; bug fix,take age; get stick; bug fix,11.38,1: but i get the_latest_update and now nothing load or play not_even the ad;<br>2: not_only will it not let_me load the video i_want_to watch the ad at the beg won't_even load;<br>3: thumbnail and ad load fine_but video don't at_all;<br>,4
topic5,1.435363,social medium; use safari; cant see,0,11.39,1: it_seem that this update have way_to many unskippable_ad and heap_of them go for_age for unskippiable ad but other wise it's gr8;<br>2: serve it basic function well there_be ad but that's alright since it's a free app anyway;<br>3: white box appear with_no content or any way_to close;<br>,5
topic5,1.280328,home button; channel art; ipad air,0,11.41,1: a_lot_of people have unlimited data plan and this be_ridiculous that i be restrict to low quality video;<br>2: i've_delete the_app and re_instal it turn_my_phone on and off aeroplane mode retard my router and nothing_seem_to work;<br>3: it work for_me fine_but one complaint;<br>,6
topic5,1.567903,fix something; wont work; use safari,0,11.43,1: the_app just_keep bug and crash out;<br>2: ad after ad after ad after ad after ad after ad after ad after ad after ad after ad;<br>3: not_even the ad that come_on before it;<br>,7
topic5,1.457102,night time; pathetic effort; obvious option,0,11.45,1: how be i suppose_to enjoy a_video when there's_an ad ever 30_second;<br>2: understand that majority_of it profit come_from ad;<br>3: click_on_a vid first the ad isn't load so i_can't_watch the vid;<br>,8
topic5,2.543165,auto play; scrub bar; pathetic effort,0,11.47,1: latest_up date prevent video from play even ad video;<br>2: no video i've_try have play even the ad freeze;<br>3: i like the box thing in the corner but ad keep_pop_up like every_minute or even a_few_second;<br>,9
topic5,3.183784,many time; subscription tab; internet connection,0,11.47.1,1: it be always the_same ad and it quickly get extremely_annoy to be stick watch an_ad about something i do_not want;<br>2: flicker from ad to ad and die at_0_00;<br>3: video don't_play anymore not_even ad do my_internet be_fine every_other app work this be literally the_only_one that doesn't;<br>,10
topic5,1.516660,important thing; offline view; last time,0,11.49,1: god_damn youtube plz_fix_this it make_me_sick <digit> <digit>;<br>2: ui <digit> but ux <digit> <digit>;<br>3: system break down again <digit> jan <digit>;<br>,11
topic5,1.684559,full screen; billion dollar; stop work,0,12.03,1: won't_even play the ad for them;<br>2: i keep accidentally_skip ad be almost always 30_second and you_can't skip_them and now there_be like <digit> ad per video;<br>3: still_can't play video since <digit> update just freak fix_it;<br>,12
topic5,1.746767,important thing; many bug; exit full screen,0,12.04,1: no_matter_how_many time you retry it never_work;<br>2: this new_update screw me up every_time_i check much time be leave in a_video it skip 30_second;<br>3: not_work after_update disappoint big time;<br>,13
topic5,1.917297,last time; spring day; stop work,0,12.05,1: i've be try_to use this_app for a_while now and safari work better_than it;<br>2: i've already delete the_app cause it_doesn't_work anymore;<br>3: it_doesn't give_me any_problem not as_much as this_app do i_think the_app be suppose_to be better i give it four thumb down;<br>,14
topic5,2.470173,keep get; spring day; many time,0,12.06,1: also try the youtube_red get a free month now <digit> week in i aparently dont have it anymore and i keep_get the try free pop_up which then say i have it but i still cant save any_video to_watch when im not on wifi to save data;<br>2: even delete it and_then re_download it;<br>3: in the case of the youtube app i would_like to say if it's_not break don't fix_it;<br>,15
topic5,1.586136,billion dollar; cellular data; keep get,0,12.07,1: i_cant_watch any_video this notification always pop_up go_wrong_tap_to retry i have a_good connection and uninstalled the_app but_nothing work;<br>2: after delete the_app and try_to download again it_say the_app be already ready to open;<br>3: i delete the_app and_re_download the_app and still not a_single_video will_load;<br>,16
topic5,2.938330,lgbt community; web browser; playback issue,0,12.09,1: work maybe <digit> of the time;<br>2: <digit> i even uninstalled youtube app reinstall it still show older_version i do_not now what to do to fix htis issue and htis app be seriously stuff_up all my_account information i lock my saftey mode in restrict it never ever stay lock and i have all_my stuff sycning with my google this_app be commit violentions in the fact i have adblocler instal on my mac if my mac be sycned with my_iphone this adblcler should_be blcking ad off my youtube sync mean sync_with account across and link to google fix_this up i don't pay hundred_of dollar ofor a internet to_see ad on any_of my_device;<br>3: but no you_guy decide_to make_us waste our time and piss us off;<br>,17
topic5,1.542514,multiple time; bug fix; wifi connection,0,12.10,1: most_of_the time this never_work and im constantly delete this_app and get it again to_see if it work;<br>2: tap_to_retry but doesn't_work no_matter_how_many time i hit retry;<br>3: please_remove this update because it be break or rework it i have delete the_app and_re_download the_app multiple_time and only_one time it work and now it_doesn't;<br>,18
topic5,2.032735,keep get; background play; error message,keep get; background play; web browser,12.11,1: every_video i watch will_play for like <digit> second and it will buffer for almost <digit> minute before it play for_a_few second;<br>2: it will basically act_like it's go_to play but then act_like it's freeze or_something and won't_even get past the first second_of the ad or video;<br>3: no video be play anymore and i keep_get the message_something_go wrong;<br>,19
topic6,1.606773,right hand; audio keep; billion dollar,0,11.30,1: my video would stop sometime for a split second and it cause the audio and video to not match;<br>2: video would always stop for a split second and_then it wont match the audio;<br>3: nearly everyvideo be keep_on stop sync_with video and sometimes it stop the video play from the start but the audio still go_on;<br>,1
topic6,1.449960,long time; audio continue; make sense,0,11.34,1: these new rule be idiotic every_time_i go_on one_of my subscribe youtubers on there video it_say im go_to quit youtube why_can't youtube just go_back_to the way it be it be way more fun now i_can't enjoy youtube anymore;<br>2: hi my name be ms yvettemarie and when make my review i'm go_to be_honest and upfront cause that's what i do always honest with people yeah tell em straight me best way_to be i_reckon and the truth be i_reckon youtube be pretty slack because when_i try_to load a_video it_take a_good 10_minute to load and i_reckon it can't be issue_with my_wifi because i always_have sufficient wifi and so i'm guess the issue must_be on youtube's side which_be a_bite unfortunate because youtube as a very proud very strong black woman who descend from be part aboriginal malaysian and although very proud of my malay heritage i identify as be aboriginal very proud of my race and where i come_from and i only access your channel to educate myself on my wonderful history and culture of indigenous australia but i have to say i'm quite disappoint when your video take_forever_to load and so i would please ask that you rectify any issue you may_be encounter on your end thank so_much and overall i_reckon your_app be marvellous despite the problem i encounter try_to get the video to load so good one thank guy;<br>3: every_time_i try_to go_to someone's youtube channel it_doesn't_let me and it keep go_back_to all channel and i have to click a_couple more time until i'm_able_to fully view just one person's channel;<br>,2
topic6,1.617172,connection error; subscription page; right hand,0,11.35,1: this recent_update somehow have make video load a_lot slower than normal on my home wifi;<br>2: can someone make a_good video share service already;<br>3: can't_even load video why not make it so that we can't_watch video great_idea;<br>,3
topic6,0.983530,get stick; live stream; wont work,0,11.38,1: video doesn't_even start play when_i tap_on them it start at_0_00 and stay_there forever might as_well don't update right;<br>2: but it when your video freeze at the start of the video and not move;<br>3: when_i try_to watch_a video it will_play until about half_way and_then it will skip the picture to the near the end but the sound will_still be where i be still watch and_then when_i try_to put skip it back_to where i be it just go_to the start;<br>,4
