key,value,label,emerlabel,version,sent1,num
topic0,1.548463,billion dollar; many time; keep crash,say something; watch anything; relate video,11.30,1: it keep_tell_me something_go_wrong_tap to_retry i tap it close the_app then back in and turn_off my_phone then go_back in;<br>2: i'll watch one video and_then get a something_go_wrong_tap to_retry;<br>3: everything be_fine_until today when_i update the_app and suddenly i_cant view the video_anymore only_thing mention be something_go_wrong_tap to_retry and re tap doesnt_work;<br>,1
topic0,1.586465,say error; web browser; use safari,0,11.34,1: i usually ask to be pay when_i'm force to_watch advertisement and get nothing in return for it;<br>2: hi my name be ms yvettemarie and when make my review i'm go_to be_honest and upfront cause that's what i do always honest with people yeah tell em straight me best way_to be i_reckon and the truth be i_reckon youtube be pretty slack because when_i try_to load a_video it_take a_good 10_minute to load and i_reckon it can't be issue_with my_wifi because i always_have sufficient wifi and so i'm guess the issue must_be on youtube's side which_be a_bite unfortunate because youtube as a very proud very strong black woman who descend from be part aboriginal malaysian and although very proud of my malay heritage i identify as be aboriginal very proud of my race and where i come_from and i only access your channel to educate myself on my wonderful history and culture of indigenous australia but i have to say i'm quite disappoint when your video take_forever_to load and so i would please ask that you rectify any issue you may_be encounter on your end thank so_much and overall i_reckon your_app be marvellous despite the problem i encounter try_to get the video to load so good one thank guy;<br>3: i attempt_to view_any_video all i get be a_message at_the_bottom that say_error while load video what's the_point_of have youtube if_you cannot_even view anything in_my_subscription;<br>,2
topic0,3.747148,sub box; full screen; auto play,subscribe channel; sub box; major problem,11.35,1: i'm use an <digit> run on_io_10;<br>2: while i believe many others share the common opinion with me that the official youtube app have many many flaw i still give it a <digit> star_rat because after all i have be use it and feel safe sign_in as it be the official_app;<br>3: today <digit> <digit> the_top panel of icon option such_as my_subscription list what's trend etc disappear;<br>,3
topic0,1.077934,subscription list; bug fix; take age,0,11.38,1: s plz give option_to skip all add longer then 5_second or_at_least all 30_second_ad iv have to resort to watch_vids_on safari not_impress;<br>2: or a bug u have update;<br>3: must_be a glitch or a bug;<br>,4
topic0,1.435363,social medium; use safari; cant see,0,11.39,1: thumbnail only show_up as a grey colour;<br>2: i've_try_everything to fix_it but the thumbnail aren't show_up;<br>3: and also give_us a way_to change thumbnail on_io or_at_least a quick way_to get to desktop mode;<br>,5
topic0,2.010985,home button; ipad air; find anything,home button; find anything; keep freeze,11.41,1: why_do u make it <digit> i watch nothing violent just sometimes put it to <digit>;<br>2: it only stay_on <digit> min and <digit> sec;<br>3: this way involve about <digit> extra click and only sometimes work;<br>,6
topic0,1.881615,home trend; home page; multiple time,0,11.43,1: please move the navigation bar subscription trend etc back_to the_top;<br>2: there's_no error cod or_anything for reference leave it up to user to lookup answer on place like yahoo answer to try and figure_out why;<br>3: since this new_update i be_able_to slide through the home_trend subscription and library easily;<br>,7
topic0,1.590498,side bar; full screen; cellular data,0,11.45,1: i like the_fact_that i_could view a vertical footage fullscreen without have to go horizontal and see <digit> 3rds of black;<br>2: i_don't_like it because i've be so use to the tab icon be at the_top and now it's be move to the_bottom it's also harder_to see them because_they aren't red anymore and they hide with the_background colour color which_be white;<br>3: <digit> carry it to a_new horizon;<br>,8
topic0,1.282482,try delete; mise jour; background playback,0,11.47,1: depuis <digit> semaines je n'arrives pa regarder de vid_os sur youtube et pourtant ma copine qui a le m_me t_l phone que moi y arrive sans probl me;<br>2: the watch next tab be completely miss now <digit>;<br>3: all_these weekly patch only serve to keep youtube at the top_of the chart with the horribly low average score of <digit>;<br>,9
topic0,1.567078,comment section; playback issue; keep write,0,11.47.1,1: all i see be an empty comment_section with the number_of comment;<br>2: maybe i_want_to read what i'm respond_to midway through type hence why i hide the keyboard only to find i_can't get back_to my_comment you_guy on the pilot program;<br>3: can't_reply to comment which suck when your start your channel and want_to interact with your commenters;<br>,10
topic0,2.006363,watch vids; playback speed; grey screen,0,11.49,1: for something that's be around so_long it look_like a beta and a fail at that;<br>2: guess you an only have the iphone app if_you have enough money to buy a_new phone;<br>3: also now the_app doesn't go_back_to where_you be in suggestion after you've watch something;<br>,11
topic0,1.769781,home page; billion dollar; pause button,home page; billion dollar; nothing happen,12.03,1: all_these weekly patch only serve to keep youtube at the top_of the chart with the horribly low average score of <digit>;<br>2: they completely ruin the interface of go from home to trend to subscription;<br>3: look youtube this double_tap_to go forward_or_backwards 10_second would be a_good idea if it didn't take_up the_whole screen;<br>,12
topic0,3.153149,keep press; many bug; double tap,important thing; keep press; many bug,12.04,1: maybe not make the_whole screen sensitive for this and just a_small space on the screen;<br>2: i make a animal jam stream that be half an_hour than when_i be gonna post it crash ok number one fix the glitch_where it crash when your do a stream when your try_to upload it number to fix giltches number three make dis let u do <digit> hour vids again;<br>3: it make me really just want ti get off youtube;<br>,13
topic0,2.199342,nothing happen; spring day; full screen,0,12.05,1: all_these weekly patch only serve to keep youtube at the top_of the chart with the horribly low overall score of <digit>;<br>2: ever_since i update youtube it's no_longer compatible with my_ipod <digit> even_though the detail say io_8_or later i be on_io_10;<br>3: ability_to thumb up or down <digit>;<br>,14
topic0,2.393713,spring day; keep get; say error,0,12.06,1: <digit> min of usage on charge and ive lose about <digit> of battery;<br>2: the audio have completely_stop work after the_new_update give today on my i phone <digit>;<br>3: ever_since_the new_update_come_out with the completely new redesign in <digit> the load have be much slower everything have be glitchy buggy and what's more annoy be waste your time to tap the arrow to_see the description;<br>,15
topic0,1.608072,third party; next time; get stick,0,12.07,1: use to work but after_update it will_load the ad but won't_play them result_in me not_be_able to watch_any_video;<br>2: and if the ad fail_to chooch then the_whole thing tell_you that you have to tap_to_retry;<br>3: look_like i have to go_back_to use a third_party youtube app again;<br>,16
topic0,3.325908,live stream; lgbt community; keep get,lgbt community; playback issue; live stream,12.09,1: get the something_go_wrong error also;<br>2: this latest_update have completely trash the youtube app what sort of quality control do you have when_you fix a_small problem and completely wreck the_rest_of your product get some decent coder and improve your qa;<br>3: this really suck because i_can't get it on_my_ipod;<br>,17
topic0,2.920124,background playback; double tap; pause button,background playback; useless feature; keep crash,12.10,1: often comment give away the_end_of a_video so it's irritate we can't hide the comment then open them if_we_want to read_them;<br>2: also when_i scroll_down at_the_bottom comment it buffer it's_not mild buffer but it's infinite buffer;<br>3: and why the_heck sometimes_there's comment and description section that won't usually load;<br>,18
topic0,1.584071,say something; relate video; watch anything,say something; watch anything; relate video,12.11,1: it keep_tell_me something_go_wrong_tap to_retry i tap it close the_app then back in and turn_off my_phone then go_back in;<br>2: i'll watch one video and_then get a something_go_wrong_tap to_retry;<br>3: everything be_fine_until today when_i update the_app and suddenly i_cant view the video_anymore only_thing mention be something_go_wrong_tap to_retry and re tap doesnt_work;<br>,19
topic1,1.556543,keep crash; get stick; long time,0,11.30,1: youtube be suppose_to be a free app for people to_watch their favourite youtuber but_now you have to pay to_watch a_bunch_of stuff;<br>2: seriously when_you have idiot spamming you on_facebook or someone you_can't exactly ingore for_a_bite it's kinda stupid how you cant put your_phone on silent to_watch youtube i swear it so_stupid;<br>3: but_now it's not_available below ios8;<br>,1
topic1,1.599742,make sense; billion dollar; web browser,0,11.34,1: i_can't reply_to a person_who comment on someone original comment i_can_only reply_to the_original comment please_fix_this when_i like a_video and_then click off the video and_then click_on it again my like be go when_i give a_video a thump up or a dislike after i refresh the page the like be go;<br>2: fix the comment plz can't_even tell the difference_between comment and reply and everything_else you do in the update scrap it and start over plz;<br>3: thank_for make it impossible_to direct reply_to a user what's the_point_of even have a forum that restrict you to just make random comment;<br>,2
topic1,3.695606,relate video; right hand; offline view,live stream; auto play; pause button,11.35,1: when_i try_to watch video the ad and the video won't actually play;<br>2: if i tap a relate_video there_be currently no_way to simply go_back_to the previous video as there would be in a browser without go_to the history section and play the_last video;<br>3: video still stop and cannot be play again;<br>,3
topic1,1.466969,get stick; bring back; take age,0,11.38,1: ever_since_the update video load_but dont play;<br>2: seem_to me a_lot_of people now can't_watch video due_to a bug include myself;<br>3: after the update i_can't seem_to play the video and thats so_frustrate cuz youtube isn't some small company and bug like this should_be immediately fix;<br>,4
topic1,1.596210,multiple time; pause button; social medium,0,11.39,1: when_i click_on_a video to_watch it load_but doesn't_play;<br>2: the video would load_but it wouldn't ever start play;<br>3: reoccurring issue since_the last_update video add load_but won't_play some day it will work then next they won't multi bil company would think this_issue would have be resolve immediately by now smh;<br>,5
topic1,1.483623,find anything; ipad air; offline mode,0,11.41,1: why_do_you need_to go_to a_different page to read the comment reply;<br>2: when_you get to the comment you go_to another_page when_you try_to see the reply;<br>3: recent downdates they sure as_hell ain't update when_you tap_on a comment it instantly go_to reply_to it so when_i try_to scroll_through the comment a reply come_up out_of nowhere;<br>,6
topic1,1.352583,use safari; double tap; cellular data,0,11.43,1: why_do_you make the_app worse and worse every_time you create some trash update;<br>2: you're make the_app look worse and feel worse each_update;<br>3: instead_of be_able_to see_what video they have make with hair in the title i have to trawl through all their video simply scroll and scroll and scroll;<br>,7
topic1,1.446078,night time; wont load; wont let,0,11.45,1: the_main part_of youtube be to be_able_to watch video but you can't_watch them so please_fix_this or_else i will probs never use the_app again;<br>2: most video that i_click_on won't_load it's_really_annoy because i have to skip video i really_want_to watch;<br>3: what_happen_to the video i be about to_watch a shawl hijab but_nothing come what_happen;<br>,8
topic1,2.771909,auto play; scrub bar; side bar,0,11.47,1: the_home_screen also_sometimes have limit scroll for video new video do_not load when_you keep scroll_down;<br>2: since_the new_update there_be_no recommend video in the side_bar when_you watch_a video;<br>3: when_you change the video quality you will get video error;<br>,9
topic1,2.143287,audio keep; exit full screen; get stick,0,11.47.1,1: i suddenly cannot seem_to be_able_to watch video at_all the video_will_load and_then the load ring will just hang for_a_few second and_then move again;<br>2: i suddenly cannot seem_to be_able_to watch video at_all the video_will_load and_then the load ring will just hang for_a_few second and_then move again;<br>3: you shouldn't need a phone or more up to date ipad or watch video at 60fps;<br>,10
topic1,1.594925,grey screen; home button; landscape mode,0,11.49,1: keep start the video up and_then immediately go_to the grey_screen say_something_go_wrong;<br>2: the_home_screen also_sometimes have limit scroll for video new video do_not load when_you keep scroll_down;<br>3: i_cant_watch any_video without it_say video error or something_go_wrong;<br>,11
topic1,2.253500,pause button; double tap; party apps,0,12.03,1: i would very much like to be_able_to move the video slider so i_can skip_ahead in a_video rather_than spend most_of_the video try_to actually click the slider;<br>2: you've previously have icon beside the pause_button instal for this feature and i feel that this would be a much more effective place for this command as it eliminate this annoyance;<br>3: this would cause me to double_tap which would skip video ahead by_10_second;<br>,12
topic1,1.492078,say something; numerous time; playback error,0,12.04,1: the_new_update you_can_see the video but when_you try_to play it would come_up something_go_wrong;<br>2: the_comment_section and video pane beside the play video have very_slow scroll speed and the history view isn't the_whole screen anymore;<br>3: whatever you_guy do to the_last_update i_can_only watch video in 450p now;<br>,13
topic1,1.727350,error message; full screen; keep show,0,12.05,1: be any problem_with watch video on an_app that be main purpose be to_watch video;<br>2: have the_ability to look_up other video while currently watch video go_to the side picture_in_picture <digit>;<br>3: when_i go_to look_at the video of the people i subscribe_to i get this theme page and can't_find the video i_wanna_watch;<br>,14
topic1,1.782138,load circle; fix something; keep crash,0,12.06,1: i see video i don't wanna see;<br>2: the new swipe_up feature for more video be annoy it's so pointless;<br>3: after the_newest_update it_won't_let me watch video it just_say_something go_wrong;<br>,15
topic1,1.564623,keep get; stupid message; watch anything,0,12.07,1: every_single_video i_try and watch it_say tap_to_retry tap and nothing;<br>2: i_cant_watch a_single_video it just_say tap_to_retry and it doesnt_work pls_fix it i_couldn't watch for 2_week;<br>3: hey_google can_you fix_this it_keep_say tap_to_retry and i_can_barely watch_any_video;<br>,16
topic1,1.510590,live stream; stupid message; watch anything,0,12.09,1: except you don't see us as people like you and you make that clear;<br>2: scheme to get people to subscribe_to youtube_red i see;<br>3: the_old_version work_perfectly but you keep give_us more_bug in each_update;<br>,17
topic1,1.557363,background playback; pause button; keep get,0,12.10,1: whenever the video quality be change to 720p or 1080p it buffer and never_load ever again;<br>2: no_way to change default maximum video quality when on meted wi_fi;<br>3: i have_no problem load the channel and playlist but the video have an_error and youtube keep_tell_me to_retry but_nothing change;<br>,18
topic1,1.584071,relate video; say something; watch anything,0,12.11,1: no ability_to refresh a page no comment view no relate_video;<br>2: i be_unable_to see the description_of any_video because_of this_issue;<br>3: it come_up and say_something thing go_wrong and to_retry it;<br>,19
topic2,1.556543,long time; keep crash; get stick,0,11.30,1: all that happen be a load symbol in the_middle and this can happen_for a really long_time;<br>2: for the love of_god please_fix_this;<br>3: visual sometimes black out generally a frustrate and unpleasant experience to use the_app but i don't have a choice but to use it so;<br>,1
topic2,1.599742,make sense; billion dollar; web browser,0,11.34,1: dan howell might be no_more in a_week if_u don't;<br>2: good_job youtube not_only do you have terrible guideline and demonetise you_tuber video bite actually make youtube eveworse;<br>3: cannot link to tv through wifi;<br>,2
topic2,2.195462,would rate; keep write; sub box,0,11.35,1: i would_rate higher if i wasn't get the glitch everyone_else be get;<br>2: when_i like a_video it get automatically add to my_playlist of like video but if it get delete it stay in the playlist as simply a delete video and i have_no way of remove it from my_playlist;<br>3: repeatedly get a keep disregard pop_up that_you_can remove and have to restart the_app;<br>,3
topic2,1.223582,get stick; bring back; bug fix,0,11.38,1: there's_a glitch in the_new_update where video_won't_play anymore it's some_thing youtube need_to fix_asap;<br>2: with the_new_update i_can't_even play a_video it stay_on one frame and won't continue;<br>3: terrible the ad make a miserable experience also continuous glitch;<br>,4
topic2,0.858523,try everything; watch vids; social medium,0,11.39,1: i have try_everything well maybe not everything i've turn_off my_ipad and turn it back on i've turn_off my_internet and turn it back on any many_other thing but_nothing work;<br>2: ever_since that new_update_come_out the video be all load everything work but it_doesn't_work so please do_something about it even my_friend experience the_same_issue so i'll_give it 1_star;<br>3: may i know_why after i update my_ipad youtube app be remove;<br>,5
topic2,1.361675,full screen; long time; channel art,0,11.41,1: and i_love dan and phil and want_to_see the amaze tour be not on fire but it cost money and i'm break as;<br>2: i really love use youtube to past the time and it have amaze content and everything;<br>3: everything be okay but this auto full_screen where_you want_to_watch it full_screen switch out even_though you be in a horizontal position;<br>,6
topic2,1.816543,next time; full screen; channel art,0,11.43,1: <digit> <digit> until it's fix;<br>2: this week after an_hour i_could go from <digit> down to <digit>;<br>3: when_i change from landscape_mode back_to portrait my_ipad display get zoom and <digit> <digit> of the screen actually blackout;<br>,7
topic2,1.370066,many people; night time; something wrong,0,11.45,1: please_fix_this issue as it be an inconvenience for many_people;<br>2: at_first_i think if be my_wifi then i saw other_people have the_same_problem please_fix_this because i really love_this app amy;<br>3: i_don't_know if this be because_of the update or my_internet_connection but by judge the other comment here and see_how none_of my_other_apps or internet stuff be affect please_fix_this bug;<br>,8
topic2,1.756564,keep crash; background playback; tap twice,0,11.47,1: app be break keep_crash and no fix please repair so issue doesn't happen_again;<br>2: i_love_youtube but the_app need plenty of work it_seem now everybody have their_own problem won't_let_me sign_in won't_let_me search something my problem be that the video stay permanently pause so for now unusable wake_up google fix_this every like you now keep this reputation and fix youtube;<br>3: you've upgrade since_the issue start but it hasn't fix anything;<br>,9
topic2,1.593392,many bug; playback issue; many people,0,11.47.1,1: g when_u start a_video and turn ur_device off as_soon_as it start it stay stick_on 0_00 the description also_sometimes go black;<br>2: i need_to see_my_subscription on the go;<br>3: freeze before start need_to close all the apps to make it work but will happen_again when re_open it;<br>,10
topic2,2.025451,multiple time; internet browser; web browser,0,11.49,1: retarted my_phone and even get a_new phone;<br>2: a_video work for <digit> minuet than every_video have an_error thing on it;<br>3: i have to_close and open it multiple_time to get it work;<br>,11
topic2,1.688778,party apps; skip thing; full screen,0,12.03,1: the_last_update didn't_work so please get it fix cause i'm do with this_app;<br>2: new developer be need_to get a_fresh perspective on all the problem_with_this app;<br>3: once we get use to one interface it change again;<br>,12
topic2,1.492845,home page; billion dollar; say something,0,12.04,1: i won't be update after ever again after this get fix;<br>2: i kindly request to get this fix;<br>3: i make a animal jam stream that be half an_hour than when_i be gonna post it crash ok number one fix the glitch_where it crash when your do a stream when your try_to upload it number to fix giltches number three make dis let u do <digit> hour vids again;<br>,13
topic2,2.170754,full screen; double tap; watch vids,0,12.05,1: ever_since i update youtube it's no_longer compatible with my_ipod <digit> even_though the detail say io_8_or later i be on_io_10;<br>2: ability_to thumb up or down <digit>;<br>3: for_example i scroll past a jenna marble video then i scroll and pass <digit> video and click_on_a shane dawson video i make it full_screen then after i close the video i'm somehow back up to the jenna marble video;<br>,14
topic2,1.690345,home button; single video; mise jour,0,12.06,1: so i be delete this_app and will use youtube browser until it get fix as this be garbage for_me;<br>2: yet it_seem that issue have return again kinda get really sick_of youtubes sh;<br>3: after <digit> freak update it do_not fix the video problem it_keep_say something_go_wrong_tap to_retry and it_keep_say the_same_thing in every freak video gonna delete this_app now;<br>,15
topic2,1.918697,billion dollar; get notification; get stick,0,12.07,1: it work a_week ago get it fix;<br>2: just get a_new phone and the youtube app won't_let_me sign_in;<br>3: when it do work it's great when it_doesn't it get really_frustrate;<br>,16
topic2,2.954800,lgbt community; playback issue; watch anything,0,12.09,1: watch_a video to a youtube playlist for_a_few day and i'm still not_sure what i be a_great way of the day_before i get a follow back on my way home_from work to be the_first_half of the day_before i get a follow back on my way home_from work to be the_first_half of the_first_half be the_best of the_first_half of the first place for_a_few year back in my head and the other hand be the_first_half of the day i get to the day i get my nail be you do the most beautiful girl i_love it and it be the_best of the_first_half of the day_before the_end_of the_first_half of the first place for the day_before i go_back and i don't think that i have a_great way of life and the other hand be the_only_thing that would_make it a_lot_of the day i will_never get a_new phone case you want me too i_guess i'll be the_best thing to say i have a_great way of life and the_first_half of the_first_half be the_best thing to say i have to go bye;<br>2: that's_all i'm get and i'm_sick_of it;<br>3: you get your jolly by pick on us canadian;<br>,17
topic2,1.677820,useless feature; playback issue; obvious option,0,12.10,1: seriously youtube get the_app fix;<br>2: i've_try fix the internet retry redownloading and restart;<br>3: have not_work since_upgrade despite try all recommend fix;<br>,18
topic2,1.557402,bug fix; watch anything; background play,0,12.11,1: my youtube app on_my_iphone <digit> here always_crash now for_some_reason;<br>2: <digit> of the time i_click_on a_video it's crash the_app plus there's so_much ad i_don't_know if that's the publisher ad or youtubes ad please_fix i'm get tire_of this;<br>3: this have be happen to me for <digit> <digit> day;<br>,19
topic3,1.465801,audio keep; keep get; billion dollar,0,11.30,1: every_video get a_few_minute in and hiccup cause the audio and video to go_out_of sync;<br>2: all video i watch be jittery and the audio get_out_of sync;<br>3: the problem be the video and audio_keep on stuff_up and not sync and sometimes freeze the video and audio play;<br>,1
topic3,1.445197,long time; audio continue; say error,0,11.34,1: when_i play a_video the video skip to the start again while the remain audio play on;<br>2: i_can't reply_to a person_who comment on someone original comment i_can_only reply_to the_original comment please_fix_this when_i like a_video and_then click off the video and_then click_on it again my like be go when_i give a_video a thump up or a dislike after i refresh the page the like be go;<br>3: can_you stop recommend live video even_when i say not_interest and when_i watch_a video to with something do_not mean i what it on my recommend list and lastly when_i reload the page i expect new video not just the_same video with one video difference;<br>,2
topic3,1.926336,subscribe channel; sub box; several time,0,11.35,1: youtube be such_a good_app for device but the_newest_update make it not the_best when_i try_to click_on_a channel in the subscribe bar it_doesn't go_into there channel so i have to search up there channel and it_take more time;<br>2: when_i try_to click_on my subscribe_channel to view video the_app doesn't select that specific channel and just show the all channel section;<br>3: when_i click a channel it won't_show there page;<br>,3
