key,value,label,emerlabel,version,sent1,num
topic0,1.212213,many time; keep press; billion dollar,0,11.30,1: frequently get play back error and can't be fix even on good_wifi also when_i try_to rotate the screen it don't rotate many_time it's_annoy after a_while;<br>2: usually you'd get to_see what volume you're at on a square like display thing that come_up on your screen;<br>3: happen_for every_video i watch it will go_out_of sync for awhile and sync back repeatedly which get very_annoy;<br>,1
topic0,1.541531,whats wrong; make sense; billion dollar,0,11.34,1: these new rule be idiotic every_time_i go_on one_of my subscribe youtubers on there video it_say im go_to quit youtube why_can't youtube just go_back_to the way it be it be way more fun now i_can't enjoy youtube anymore;<br>2: i_can't reply_to a person_who comment on someone original comment i_can_only reply_to the_original comment please_fix_this when_i like a_video and_then click off the video and_then click_on it again my like be go when_i give a_video a thump up or a dislike after i refresh the page the like be go;<br>3: every_time_i try_to go_to someone's youtube channel it_doesn't_let me and it keep go_back_to all channel and i have to click a_couple more time until i'm_able_to fully view just one person's channel;<br>,2
topic0,2.504457,keep write; full screen; relate video,0,11.35,1: sound no picture tap screen picture be there but freeze sound lip sinc be out;<br>2: sound no picture tap screen picture be there but freeze sound lip sinc be out;<br>3: either add a back_button or allow swipe from the leave edge to retrace your step without have to go all the way into the view history;<br>,3
topic0,1.318091,take age; bug fix; get stick,0,11.38,1: the quality be horrendous even ad now be in poor quality video take_age to load and even longer to load 720p focus less on add new_feature and more on fix the one we've get seriously youtube get a grip;<br>2: s plz give option_to skip all add longer then 5_second or_at_least all 30_second_ad iv have to resort to watch_vids_on safari not_impress;<br>3: it's_really get annoy and on my nerve;<br>,4
topic0,1.435363,social medium; use safari; cant see,0,11.39,1: white box appear with_no content or any way_to close;<br>2: and also give_us a way_to change thumbnail on_io or_at_least a quick way_to get to desktop mode;<br>3: it_seem that this update have way_to many unskippable_ad and heap_of them go for_age for unskippiable ad but other wise it's gr8;<br>,5
topic0,1.562933,find anything; ipad air; keep get worse,0,11.41,1: when_i restart_my_device i almost have a dead blue screen;<br>2: a_lot_of people have unlimited data plan and this be_ridiculous that i be restrict to low quality video;<br>3: when_i search stuff and more and more it's_annoy it stay_there and i wanna get it remove private stuff i do but i don't_want anyone to_see it you know_what i mean;<br>,6
topic0,1.942599,landscape mode; home trend; next time,0,11.43,1: we finally get use to it and_then you change it again every_single_time;<br>2: youtube keep change the model on_io and finally they get it right and it be good_but then they change it again to this garbage and now it's so_much less smooth;<br>3: when_i change from landscape_mode back_to portrait my_ipad display get zoom and <digit> <digit> of the screen actually blackout;<br>,7
topic0,1.571233,side bar; cellular data; keep get,0,11.45,1: random connection issue even_though i'm always on full bar random crash;<br>2: too_much add that i'm_not able_to skip;<br>3: it_doesn't it's a light blue instead_of the dark one;<br>,8
topic0,1.795842,scrub bar; side bar; cant see,0,11.47,1: when_you change the video quality you will get video error;<br>2: and now i don't get recommend video at_all underneath video;<br>3: when watch_a video in_full_screen_mode under the scrub_bar there_be recommend video which pop_up onto the screen if_you even accidentally touch the damn screen also scrub be a_pain with the recommendation pop_up instead_of let_me scrub remove this;<br>,9
topic0,1.811780,data usage; cellular network; get stick,0,11.47.1,1: sometimes i_can't exit out_of a_video like the video keep play and everything be normal almost like i'm_not even press the minimize screen button;<br>2: and give viewer the option_to view specific video at a higher frame rate on their ipads irregardless of the generation of the model;<br>3: please_fix ive get a problem when_ever i minimise the vid and drag it down to the_bottom right corner it go all the way up the_top leave of my_screen and if i tap another video it go_back_to the_same video please_fix;<br>,10
topic0,1.922820,play button; offline view; important thing,0,11.49,1: when the video i'm watch_a video half_way_through it freeze for_about <digit> minute then start play again sometimes it_doesn't play_at_all and i have to_close the tab and re_open it again;<br>2: i will add a_video to a_playlist that's already offline and what should happen be when_i go_into the offline version_of that playlist i should say sync new video but it_doesn't it_doesn't do_anything other_than drain_my_battery and heat it up to <digit> degree celsius around <digit> degree fahrenheit as i_try to find a way_to get it to work;<br>3: everyday i have to_close my_phone totally for watch_a video even after <digit> update;<br>,11
topic0,1.818096,double tap; rewind button; nothing happen,0,12.03,1: while it be still possible to drag the time bar the bar be so small you almost inevitably tap the screen and rewind fat forward;<br>2: the recently implement feature which make it that if the side_of_the screen be tap the video either fast_forward_or rewinds be extremely_annoy as it cause many accidental time skip;<br>3: look youtube this double_tap_to go forward_or_backwards 10_second would be a_good idea if it didn't take_up the_whole screen;<br>,12
topic0,2.143391,say something; full screen; double tap,0,12.04,1: since there_be button on the leave and right of the video that take_up more_than <digit> 9ths of the screen every_time you don't tap in the exact middle column it will take more_than 1_second for the control to show_up;<br>2: when in_full_screen tap the vid be really_slow delay but double_tap be_fine and plz go_back_to the_old one plz where u touch the screen it's instant;<br>3: please_add a button to disable the two tap ten_second skip it get very_annoy;<br>,13
topic0,1.313129,nothing happen; keep show; full screen mode,0,12.05,1: the_app doesn't crash but when_i click i video to_watch it do_not_play at_all;<br>2: h this start today when_i be look on my_subscription video and the thumbnail be literally all distort and glitchy lot_of odd white stuff everywhere on the thumbnail please_fix it;<br>3: when_i try_to resume it try_to play an_ad even_though there_wasn't a stop for one and_then say_something_go_wrong;<br>,14
topic0,2.103163,keep get; single video; home button,0,12.06,1: i get log off by the_new_update and now i_can't log_in back;<br>2: every ad i get be a 30_second_ad that i_can't skip;<br>3: i open the_app after_update it and i get log out_of_my_account and i_can't manage_to get back in so i have to make a_new one lose_all my_playlist;<br>,15
topic0,1.840749,ipad air; nothing happen; get stick,0,12.07,1: i've click about <digit> video and they load for_about <digit> second_then a screen pop_up say_something_go_wrong tap_to_try_again;<br>2: whenever_i load a_video i either get a drone repeat sound or no_sound at_all;<br>3: every_time you get to the home tab video show_up for_a_bite then when_you scroll_down a_video every_video on the page disappear this have be happen_for the_last <digit> update;<br>,16
topic0,1.816197,lgbt community; main thing; home button,0,12.09,1: fix_this i_can't_watch even <digit> video because it just doesn't_play;<br>2: <digit> <digit> <digit> be it me or be it the video can't be play;<br>3: no_matter_what the video do_not_play it always_have the tap_to_retry screen and it so_annoy;<br>,17
topic0,2.122221,pathetic effort; obvious option; double tap,obvious option; pathetic effort; background playback,12.10,1: when_i press a_video be say_something_go_wrong tap_to_retry so i tap and it play for_about 20_second before the message_come_up again;<br>2: i_hate accidentally_click the button then have to remove the_app from my_tv;<br>3: have the button in a spot where_you consistently bump it and to not have the option whether you choose to connect_to the tv be a_huge pain;<br>,18
topic0,1.737151,stupid message; keep get; keep show,0,12.11,1: very_annoy how near the_end_of the video a_little bubble pop_up with a recommend or next video;<br>2: no_matter_what video i_try to_watch the message_something_go wrong_try_again pop_up;<br>3: towards the_end_of the video it go_back_to footage from earlier in the video;<br>,19
topic1,1.548463,many time; keep crash; get stick,comment section; background play; wrong tap,11.30,1: lot_of crash like and dislike won't_show a_lot_of the time and comment_section a_lot_of the time doesn't_show;<br>2: it crash more time in one_day then all in an entire month;<br>3: <digit> of the time i_click_on a_video it's crash the_app plus there's so_much ad i_don't_know if that's the publisher ad or youtubes ad please_fix i'm get tire_of this;<br>,1
topic1,1.258545,offline mode; make sense; billion dollar,0,11.34,1: usually the_app work_perfectly_fine for_me but for the_past_few day when_i open youtube it_say it's offline and it's_not in offline_mode or_anything i redownloaded it update my_ipad and all that but nothing's work not_sure_if it's a bug_or just me but can_you reply with someway to fix_it or_something;<br>2: for a billion_dollar company i'd expect something that just work and make_sense;<br>3: fix the comment plz can't_even tell the difference_between comment and reply and everything_else you do in the update scrap it and start over plz;<br>,2
topic1,2.389557,live stream; relate video; right hand,0,11.35,1: when_i try_to watch video the ad and the video won't actually play;<br>2: when_i click_on_a video everything be normal but it_doesn't allow_me_to watch it it would say it's play but it's freeze;<br>3: also when_i watch live_stream video it come_up and put me on live when the live_stream be do then it disconnect me;<br>,3
topic1,1.466969,take age; bring back; get stick,0,11.38,1: i look forward for a fix as i_can't_watch youtube right_now;<br>2: after the update i_can't seem_to play the video and thats so_frustrate cuz youtube isn't some small company and bug like this should_be immediately fix;<br>3: i_try delete the_app and download it again but it didn't fix anything;<br>,4
topic1,1.285333,try everything; social medium; use safari,0,11.39,1: reoccurring issue since_the last_update video add load_but won't_play some day it will work then next they won't multi bil company would think this_issue would have be resolve immediately by now smh;<br>2: i need_to reboot my_ipad to fix the problem;<br>3: hello i_love_youtube and it's great to have it on_my_ipad and i_know that_there_be gonna be a_few bug most_of_the bug this_app have doesn't really effect me but after the_new_update there's one that do;<br>,5
topic1,1.483623,find anything; ipad air; offline mode,0,11.41,1: i've_delete the_app and re_instal it turn_my_phone on and off aeroplane mode retard my router and nothing_seem_to work;<br>2: the little red circle need_to be bigger so tiny;<br>3: reset my router still nothing;<br>,6
topic1,1.121731,cellular data; next time; wont load,0,11.43,1: google get_rid_of the ego and actually make the_app work;<br>2: many glitch the_app randomly freeze and exit when connect_to_wifi app think there no_connection then i have to use cellular_data to make it work other_than_that it can be a_great app;<br>3: i'm honestly surprise i really didn't think ya'all could have make the youtube app any worse_than it be;<br>,7
topic1,1.782315,channel art; sub box; top comment,0,11.45,1: you still have not fix the error about the channel banner not_be_able to upload and in top_of that now i_can not_even change_my profile picture anymore;<br>2: please_fix it banner and profile picture make a channel good;<br>3: can_you please_fix the new bug_where you want_to load a_video than it load_but it_doesn't load and it make me really angry;<br>,8
topic1,2.176126,keep crash; double tap; pathetic effort,0,11.47,1: need major work who ever make this update need_to be fire;<br>2: okay these really need_to be fix;<br>3: it's_not even need if_you find a fix just_leave it below the video description area like bruh idgaf about ur recommendation stop think about what you think i might like;<br>,9
topic1,1.431898,keep say; wrong tap; third party,0,11.47.1,1: they will always show_me something weng wrong_tap to try_again please_fix it immediately;<br>2: my video_aren't work they always_say_something_go wrong even_if i use_safari it_still_won't work please_fix it i miss youtube i_try redownloading it but it still wind not_work ps i be on iphone_5 might be a bug for just my software;<br>3: my youtube won't_let_me log_in and keep_say try_again_later or_something and ik that my email and password be correct bc i use the_same <digit> to login on_my_laptop but it's_not work for my_ipod;<br>,10
topic1,1.271409,nothing happen; home button; terrible layout,0,11.49,1: i always get this error please_fix it;<br>2: i update the_app and still error youtube you gotta get your shi t together like you be one_of the most_popular apps out there and if_you_don't fix_this error which keep_on come your go_to loose a_big portion of you audience;<br>3: since_the latest_update i get video error;<br>,11
topic1,2.343905,wont load; party apps; stop change,party apps; wont load; audio continue,12.03,1: all the time the video make robotic noise and you cant understand what you're watch;<br>2: most if not all the time video wont_load when they can work in 3rd party_apps;<br>3: the_new_update make it look_like trash;<br>,12
topic1,1.651480,important thing; grey screen; major problem,important thing; major problem; grey screen,12.04,1: since_the last_update i get too_many_ad during video stream this be crazy;<br>2: i_can no_longer view the list_of video from channel_i'm_subscribe to since_the latest_update;<br>3: you have the perfect moment to get really excite on a_video you click accidentally twice or once idk and_then it move on;<br>,13
topic1,1.801976,last time; spring day; full screen mode,0,12.05,1: and if it do it crash right_away;<br>2: first_time in youtube history i've_never have it crash except_for today fix_it please;<br>3: just update the_app and now it's crash and not play_any_video;<br>,14
topic1,1.989635,mise jour; spring day; load circle,0,12.06,1: le pub ont ne peut m_me plus le passer et j'ai perdu mon compte youtube et impossible_de le r cup rer;<br>2: it work_great never_have any_problem on it it's_awesome keep up the good work youtube and keep make your_app better m8;<br>3: lors de_la mise_jour j'ai t d connect et depuis il m'est impossible_de le faire;<br>,15
topic1,2.484906,billion dollar; get notification; full screen mode,0,12.07,1: it work a_week ago get it fix;<br>2: when_you get to upload a_video you_can't make a thumb nail which_be very_annoy me because i don't have a_computer to make a thumb nail and like some other_people i_know who just start their_channel like me and we_don't get more sub from that please_fix now;<br>3: first_of all i have my_notification set not to email me and i get email all the time secondly i have the bell icon set to send_me notification to almost_every channel and half the time i don't get_notification;<br>,16
topic1,1.990685,chrome cast; playback issue; use safari,0,12.09,1: watch_a video to a youtube playlist for_a_few day and i'm still not_sure what i be a_great way of the day_before i get a follow back on my way home_from work to be the_first_half of the day_before i get a follow back on my way home_from work to be the_first_half of the_first_half be the_best of the_first_half of the first place for_a_few year back in my head and the other hand be the_first_half of the day i get to the day i get my nail be you do the most beautiful girl i_love it and it be the_best of the_first_half of the day_before the_end_of the_first_half of the first place for the day_before i go_back and i don't think that i have a_great way of life and the other hand be the_only_thing that would_make it a_lot_of the day i will_never get a_new phone case you want me too i_guess i'll be the_best thing to say i have a_great way of life and the_first_half of the_first_half be the_best thing to say i have to go bye;<br>2: doesn't_even work half_of the time;<br>3: for two day now any time i_try to_watch a_video it_say_something go_wrong_tap_to retry;<br>,17
topic1,1.461096,wont play; wifi connection; playback issue,0,12.10,1: something be go_on since_the latest_update i_can't view_any_video pls help;<br>2: since_the newest_update i_can't view a_single_video;<br>3: it keep sayig something be wrong;<br>,18
topic1,1.615381,comment section; background play; wrong tap,comment section; background play; wrong tap,12.11,1: lot_of crash like and dislike won't_show a_lot_of the time and comment_section a_lot_of the time doesn't_show;<br>2: it crash more time in one_day then all in an entire month;<br>3: <digit> of the time i_click_on a_video it's crash the_app plus there's so_much ad i_don't_know if that's the publisher ad or youtubes ad please_fix i'm get tire_of this;<br>,19
topic2,1.593482,billion dollar; long time; right hand,0,11.30,1: although this be happen in the_previous_update you would be_able_to pause the video and the visual would catch up again with the audio and everything would be_fine;<br>2: would also appreciate be_able_to manually select video quality_over a mobile network as be possible many version ago;<br>3: video be_stick_at the black load screen and would not load;<br>,1
topic2,1.224021,audio continue; offline mode; make sense,0,11.34,1: there a_bug_where when_i zoom into a_video and cant zoom back out and when_i click_on_a channel in_my_subscription it doesnt open;<br>2: hi my name be ms yvettemarie and when make my review i'm go_to be_honest and upfront cause that's what i do always honest with people yeah tell em straight me best way_to be i_reckon and the truth be i_reckon youtube be pretty slack because when_i try_to load a_video it_take a_good 10_minute to load and i_reckon it can't be issue_with my_wifi because i always_have sufficient wifi and so i'm guess the issue must_be on youtube's side which_be a_bite unfortunate because youtube as a very proud very strong black woman who descend from be part aboriginal malaysian and although very proud of my malay heritage i identify as be aboriginal very proud of my race and where i come_from and i only access your channel to educate myself on my wonderful history and culture of indigenous australia but i have to say i'm quite disappoint when your video take_forever_to load and so i would please ask that you rectify any issue you may_be encounter on your end thank so_much and overall i_reckon your_app be marvellous despite the problem i encounter try_to get the video to load so good one thank guy;<br>3: every_time_i try_to go_to someone's youtube channel it_doesn't_let me and it keep go_back_to all channel and i have to click a_couple more time until i'm_able_to fully view just one person's channel;<br>,2
topic2,1.926336,subscribe channel; sub box; several time,0,11.35,1: when_i try_to click_on my subscribe_channel to view video the_app doesn't select that specific channel and just show the all channel section;<br>2: youtube be such_a good_app for device but the_newest_update make it not the_best when_i try_to click_on_a channel in the subscribe bar it_doesn't go_into there channel so i have to search up there channel and it_take more time;<br>3: when_ever i_want_to watch_a video it do_not come in_hd even_when i put it in_hd and secondly be when_i want_to click_on_a channel i sub_to i have to click it five time so please_fix it;<br>,3
topic2,1.466969,bring back; get stick; take age,0,11.38,1: when_i try_to watch_a video it will_play until about half_way and_then it will skip the picture to the near the end but the sound will_still be where i be still watch and_then when_i try_to put skip it back_to where i be it just go_to the start;<br>2: i_want_to be_able_to watch video again bc thats the_whole point;<br>3: not_only will it not let_me load the video i_want_to watch the ad at the beg won't_even load;<br>,4
topic2,1.596210,social medium; multiple time; pause button,0,11.39,1: g when_i be sigh into my second account and upload a_video it upload on my_first account instead even_though i be sigh out_of_my first_account;<br>2: literally just this patch when_i go_to play a_video it will_load_but it won't_play;<br>3: this social_medium egocentric stick your nose into everyone el business chat bull intrude into almost_every app and into almost_every part_of our live should_be a psychological worry to all intelligent people;<br>,5
topic2,1.299752,home button; channel art; find anything,0,11.41,1: youtube app do_not_work every_time_i play a_video it will_not_work;<br>2: i even have a_video constantly restart over and over every <digit> second;<br>3: every_time_i trie to_watch a_video it_doesn't_work it like it freeze pls_fix_this;<br>,6
topic2,1.471687,multiple time; download quality; default download quality,0,11.43,1: when_i try_to load a_video if freeze and won't_play_anything they definitely need_to_fix it;<br>2: try sign_in multiple_time every_time_i try_to sign_in it_say there seem_to_be a problem please_try_again later;<br>3: on_my_ipad when_i try_to tap_on another youtuber when look through my_subscription it_doesn't_work;<br>,7
topic2,1.318131,sub box; portrait mode; whats wrong,0,11.45,1: when_i go_to click_on_a video it just_keep on load until it_say unable_to_play video and keep loop;<br>2: when_i click_on_a video to_watch it do_not load;<br>3: when_i load youtube every thing load except_for when_i click_on_a video it just have that error tap_to_retry and i've_try_everything nothing will_load;<br>,8
topic2,1.837792,wont work; wrong tap; double tap,0,11.47,1: everytime_i click_on it tell something wrong_tap n try n it wont_work when_i click onto a_video on youtube;<br>2: really_good but when_i finish a_video and go_to click_on_another one it crash;<br>3: every_time_i finish a_video and click another one it crash;<br>,9
topic2,2.565900,scrub bar; subscription tab; subscription box,0,11.47.1,1: every_time_i try_to load a_video it_say that something_go_wrong and to_retry;<br>2: can't_get into subscription_box home and account work_fine_but when_i try_to load the subscription_box it just_say to reload but even_when i do that there's still an_error_message;<br>3: when_i press_on a_video once_in a_while the video won't_even load and if i tap_to_retry again it will just_tell_me again;<br>,10
topic2,1.329942,default download quality; download quality; fix something,0,11.49,1: then when_i pause a_video for_about 2_minute when_i have to do_something when_i try_to play it again the play_button stall for_about a minute_or <digit> then start play or doesn't start play_at_all fix pls;<br>2: give_me_an_error every_time_i try_to play a_video;<br>3: i'll have a_video play in the corner and scroll_down my fee but when_i make the video full_screen for over a minute then back_to the_home_screen;<br>,11
topic2,1.666823,nothing happen; what's wrong; party apps,0,12.03,1: i would very much like to be_able_to move the video slider so i_can skip_ahead in a_video rather_than spend most_of_the video try_to actually click the slider;<br>2: after the update whenever_i_go to play a_video it_say_something go_wrong;<br>3: text be smaller the on screen medium control while_watch a_video be now laggy i_can't play or pause the video with my bluetooth keyboard anymore and the skip_ad button be only larger for the skip_ad countdown then it's just a tiny little button much lower_than where it be before;<br>,12
topic2,1.482625,numerous time; playback error; wrong tap,0,12.04,1: every_time_i try_to watch my video it will just_say_something go_wrong_tap_to retry i_hate it when it happen it_say that with my video;<br>2: youtube crash when_i try_to open it on_my_ipad air_2 run io_10;<br>3: when_i click_on the video it_say video unavailable;<br>,13
topic2,1.438088,something's wrong; watch vids; full screen mode,0,12.05,1: every_time_i try_to play a_video it_won't_let me;<br>2: every_time_i want_to_watch a_video it just_say an_error_occur try_again_later and i do and it_keep_say that;<br>3: whenever_i_try to_watch a_video it_say there's_an_error;<br>,14
topic2,1.304382,watch anything; home button; side bar,0,12.06,1: video arent load and when_i go_to open a description the_app crash;<br>2: that be what i get when_i try_to watch video on my i phone it_doesn't_work fix_this_please;<br>3: new_update i_can't load video it_keep_say something_go_wrong_tap again and when_i do it_say the_same_thing;<br>,15
topic2,2.138937,wont load; black screen; get notification,0,12.07,1: something_go_wrong_tap to_retry that's what it_say every_time_i try_to watch_a video fix_this;<br>2: every_time_i try_to watch_a video it_say_something go_wrong;<br>3: unwanted reccomendations still appear when_i open youtube app;<br>,16
topic2,2.332003,restrict mode; scrub bar; full screen,0,12.09,1: latest_update cause youtube to crash when click_on video on_facebook;<br>2: the video i_try to_watch keep_on crash;<br>3: app be insanely buggy crash daily and video don't_even work half the time;<br>,17
