key,value,label,emerlabel,version,sent1,num
topic6,1.282482,mise jour; background playback; try delete,0,11.47,1: je ne peux plus utiliser youtube car la mise_jour <digit> d cembre <digit> ne se t_l charge pa;<br>2: depuis <digit> semaines je n'arrives pa regarder de vid_os sur youtube et pourtant ma copine qui a le m_me t_l phone que moi y arrive sans probl me;<br>3: flood with add get beyond the joke the one where_you_can skip after 5sec be_fine_but the <digit> 30sec add be a head fck also how_do you see where_you comment on a_video;<br>,9
topic6,2.511721,audio keep; play button; relate video,0,11.47.1,1: on_my_ipad mini <digit> sometimes in the_middle_of the video it play from the_begin again but the audio stay where it be originally play and i always_have to exit the video and watch it again for it to work it happen all the time pls_fix;<br>2: i_can't play video now i open the_app click_on_a video and_then it stop load after <digit> second and_then close the_app;<br>3: a very large percentage of the video i watch have to be close and_reopen on_my_ipad because the video just_freeze but the audio_keep play;<br>,10
topic6,1.942196,multiple time; internet browser; important thing,0,11.49,1: i_want_to watch video on_my_phone but_nothing work;<br>2: e let say if i upload a_video and after few_day i have <digit> view and i come to realise that the sound quality be not good or there_be_a part that i didn't want_to include in it and decide_to work on the_same video and wish to update the_old one to the correct one without loose my <digit> view;<br>3: <digit> out_of_my <digit> recommend video be from that series that i watch <digit> video on and didn't enjoy;<br>,11
topic6,1.521135,wont load; audio continue; nothing happen,0,12.03,1: ever_since_the newest_update i_can't stop accidentally_skip around the video worst_update for anything i have ever see;<br>2: all the time the video make robotic noise and you cant understand what you're watch;<br>3: video and audio be out_of_sync;<br>,12
topic6,1.610176,subscribe channel; ipad mini; skip forward,0,12.04,1: ever_since_the last_update i_can't play video;<br>2: i_can no_longer watch youtube video on_my_phone fix_it or i will delete the_app;<br>3: whatever you_guy do to the_last_update i_can_only watch video in 450p now;<br>,13
topic6,1.801976,spring day; error message; last time,0,12.05,1: with ad that count down after 5secs and you_should be_able_to click the right edge of the siri remote it sporadically decide_to work and not_work;<br>2: now every_time_i try_to open the_app it go vertical and it completely freeze i_can't do_anything;<br>3: they freeze the view on the mv like in the bts not today and spring_day;<br>,14
topic6,2.045819,home page; spring day; mise jour,0,12.06,1: a_few problem <digit> home_page will automatically scroll up after i_click_on a_video <digit> the ad be overly repetitive and more often than not with not relevant <digit> i_can't play music in the_background overall the webpage could probably do the job just the_same if not better without have the_app;<br>2: i be unsubbed from all_my favorite channel all_my watch_later vids go all_my playlist go subscribe_to people i unsubscribed to a year_ago;<br>3: i_can't subscribe_to anyone or comment on any_video;<br>,15
topic6,2.621407,full screen mode; screen mode; ipad air,0,12.07,1: i_haven't be_able_to watch video lately;<br>2: my_playlist now play on shuffle for_no_reason and lot_of crash sayin the video isn't avaible or no_connection;<br>3: good_but a_lot_of the time i press the like button for a_video on_ipad and it_doesn't_work so i_can't like video also_sometimes the comment don't_load and i_can't see them;<br>,16
topic6,2.869909,skip forward; lgbt community; restrict mode,0,12.09,1: i_love_youtube but i've_try_everything and i_can't play youtube fix_this i really don't wanna have to just_stop watch youtube;<br>2: however now whenever_i_want_to watch_a video i_can't because it just error the video say reload try_again or the stuff it_say;<br>3: so now i_can't play anything on_my_ipad;<br>,17
topic6,1.672043,keep crash; wont play; try reinstall,0,12.10,1: but when_i'm watch_a video sometimes the audio will keep play but the youtube video pause or replay from the_begin;<br>2: i_can't_even minimize youtube without interrupt payback yet several competitive apps_that also play youtube video can play in the_background just_fine;<br>3: none_of my video be play;<br>,18
topic6,2.351878,relate video; wrong tap; bug fix,relate video; bug fix; stupid message,12.11,1: something when wrong error show_up for every_video;<br>2: no ability_to refresh a page no comment view no relate_video;<br>3: like for_example it all start yesterday night while i be search a_video that i_want_to watch i find it click_on it but_for_some reason it always_crash;<br>,19
topic7,1.301483,make money; keep crash; get stick,0,11.30,1: why_can't u just make it swipe leave to remove from recommend;<br>2: hate the two button ext to the pause;<br>3: why_can't i just go_onto_a page with them;<br>,1
topic7,1.397031,last time; make sense; billion dollar,0,11.34,1: also fix_your monetisation you've make every youtuber worse_than goat with herpes;<br>2: thank_for make it impossible_to direct reply_to a user what's the_point_of even have a forum that restrict you to just make random comment;<br>3: hi my name be ms yvettemarie and when make my review i'm go_to be_honest and upfront cause that's what i do always honest with people yeah tell em straight me best way_to be i_reckon and the truth be i_reckon youtube be pretty slack because when_i try_to load a_video it_take a_good 10_minute to load and i_reckon it can't be issue_with my_wifi because i always_have sufficient wifi and so i'm guess the issue must_be on youtube's side which_be a_bite unfortunate because youtube as a very proud very strong black woman who descend from be part aboriginal malaysian and although very proud of my malay heritage i identify as be aboriginal very proud of my race and where i come_from and i only access your channel to educate myself on my wonderful history and culture of indigenous australia but i have to say i'm quite disappoint when your video take_forever_to load and so i would please ask that you rectify any issue you may_be encounter on your end thank so_much and overall i_reckon your_app be marvellous despite the problem i encounter try_to get the video to load so good one thank guy;<br>,2
topic7,1.603189,fix something; subscription page; main thing,0,11.35,1: put it back_to how it be and fix these bug;<br>2: this stupid bug have be bug me for month and result me to pay extra for my bill;<br>3: with bug like go_to your favourite youtube's and if not display there channel properly it make the youtube experience bad for the customer;<br>,3
topic7,1.223582,bug fix; get stick; bring back,0,11.38,1: must_be a glitch or a bug;<br>2: or a bug u have update;<br>3: i_can't_watch anything_anymore because an_ad will_load fully but not play;<br>,4
topic7,0.996984,slide bar; rewind button; social medium,0,11.39,1: i rat this_app for 1_star only cauz these update make no sense at_all make it more worse;<br>2: youtube's video recommendation make as_much sense as <digit> <digit>;<br>3: save a_video be just stick_at <digit> and doesn't move;<br>,5
topic7,1.546340,home button; keep get worse; find anything,0,11.41,1: i waste to much safari internet cause i watch yt like <digit> <digit>;<br>2: why_do u make it <digit> i watch nothing violent just sometimes put it to <digit>;<br>3: cause <digit> also mean mature audience it mean m rat;<br>,6
topic7,3.192448,subscribe channel; recommend section; wifi connection,home trend; skip forward; subscribe channel,11.43,1: i_know it's_not my_internet as i be_able_to watch other video such_as stream netflix in_hd;<br>2: video that i've already watch aren't be mark as view anymore;<br>3: app no_longer show what video you have watch in subscribe_channel;<br>,7
topic7,1.566272,many people; cellular data; keep crash,0,11.45,1: i never think i_could delete this_app one_day but i do believe im not the_only_one who be drive nut by this version;<br>2: i like the_fact_that i_could view a vertical footage fullscreen without have to go horizontal and see <digit> 3rds of black;<br>3: this_app never_have any trouble until the_latest_update;<br>,8
topic7,1.282482,try delete; mise jour; pathetic effort,0,11.47,1: should have make this_app to require io <digit> because most people don't have newer phone and can't afford them;<br>2: and also_why would you make youtube <digit>;<br>3: depuis <digit> semaines je n'arrives pa regarder de vid_os sur youtube et pourtant ma copine qui a le m_me t_l phone que moi y arrive sans probl me;<br>,9
topic7,1.938793,free trial; many bug; say error,0,11.47.1,1: <digit> a_month to get it and their free_trial you still need_to pay_for it that's be not what a free trail be youtube;<br>2: there's_a bug for my_phone that i_can't_watch any_video it will_just_freeze there and it have be <digit> 3days;<br>3: i_can't_watch anything on this_app every_time_i open it crash;<br>,10
topic7,2.259685,grey screen; multiple time; make sense,0,11.49,1: it keep_on say_something_go_wrong please_try_again and this only_happen on the iphone_5s every_other phone or ipad i_try use youtube on it work normally and yes youtube be update on all_device;<br>2: stop make thing difficult_to use;<br>3: fix_your stupid issue_with youtube i_can listen_to youtube on_my_ipod no_problem but the minute i_try to play something on_my_iphone then it_doesn't_work and i get the stupid something_go_wrong grey_screen and_it's_really annoy my_ipod isn't eligible for io_10 so it's under that version but my_phone be up to date;<br>,11
topic7,1.646844,rewind button; party apps; stop change,0,12.03,1: once we get use to one interface it change again;<br>2: new developer be need_to get a_fresh perspective on all the problem_with_this app;<br>3: it's horrible it's_hard to get use to and more complicate;<br>,12
topic7,1.593583,say something; grey screen; background play,0,12.04,1: ever_since that last_update i_can't_watch any_video;<br>2: this doesn't mean much since i_can't_watch anything in there or anywhere else for that matter every_single_video i_try to view flip into a_black_screen with an_error_message announce it couldn't be view;<br>3: i_can't_watch any_video until_they be like a day old;<br>,13
topic7,1.629524,say error; last time; keep crash,0,12.05,1: this_app better get it act_together;<br>2: new developer be need_to get a_fresh perspective on all the problem_with_this app;<br>3: try_again and frankly it's get quite_annoy;<br>,14
topic7,2.049317,single video; keep get; nothing happen,0,12.06,1: after <digit> freak update it do_not fix the video problem it_keep_say something_go_wrong_tap to_retry and it_keep_say the_same_thing in every freak video gonna delete this_app now;<br>2: youtube you_need_to fix the something_go_wrong stuff because i_can't_watch my_favourite_youtubers because_of this;<br>3: so i be delete this_app and will use youtube browser until it get fix as this be garbage for_me;<br>,15
topic7,1.608072,next time; third party; get stick,0,12.07,1: if_you keep_on people will just uninstall your cancerous app and move on because we_don't need that unecessary torture you make for us you as lick sh eater;<br>2: well i advise you to use insecticide next_time to kill all the bug;<br>3: i forget to update my review of the_last couple year to hey it actually stabilize and wasnt a_pain too late cuz now every launch your gdmn app tell_me to upgrade my_ipad to make use of latest feature;<br>,16
topic7,2.149572,live stream; would rate; restrict mode,0,12.09,1: it crash that much i_can't_watch anything something_go_wrong;<br>2: scheme to get people to subscribe_to youtube_red i see;<br>3: except you don't see us as people like you and you make that clear;<br>,17
topic7,1.480642,ipad mini; keep get; wifi connection,0,12.10,1: since_the new_update i_can't_watch anything it_keep_say oups something_go_wrong it happen at my school so i_think it be the wifi but it do it even_when i'm use my_wifi;<br>2: i update it and now i_can't get into it please_fix_this;<br>3: i use an_ipad and phone i update the ipad version and my god it be_terrible can't_even load a_single_video or ad;<br>,18
topic7,1.519523,background play; something wrong; bug fix,0,12.11,1: something_go_wrong be all i get;<br>2: cannot_play_any_video all i get be something_go_wrong screen;<br>3: i don't have youtube_red and i_can't_watch any_video on this_app;<br>,19
topic8,1.334555,keep crash; cellular network; get stick,0,11.30,1: every_time_i see a_new youtube io update my body fill instantly with joy;<br>2: every_time_i see a_new youtube io update my body fill instantly with joy;<br>3: youtube keep_crash for_me so i be tell to delete it from my_phone and try_again;<br>,1
topic8,1.541531,whats wrong; make sense; billion dollar,0,11.34,1: i don't have a issue_with the youtube app it's great_app and i've be enjoy the recent_update to it but this new_one be just bad i'll be specific the_comment_section be bad because it look awful just try_to see more reply send_me to some dumb sub page and again it look awful hopefully the_next_update return_to the previous one;<br>2: the previous time i delete my youtube an download it again it tell_me i need_io_8;<br>3: i be about_3 month_ago and i be clear out my_phone but then i delete youtube;<br>,2
topic8,2.660211,subscription fee; landscape mode; comment section,subscription fee; relate video; landscape mode,11.35,1: it would_really improve the youtube experience for us user if_you_could solve_this problem;<br>2: i'm a iphone_4 user and this irritate me a_lot;<br>3: since_upgrade to io_10 and install the_new_update of youtube;<br>,3
topic8,1.223582,bring back; get stick; bug fix,0,11.38,1: this_app have an_update and wouldn't do the update i've now delete the_app and now i_can't download it this be_really_annoy;<br>2: i will have to either restart_my_phone or close the_app wait 10_minute then try_again;<br>3: i_try delete the_app and download it again but it didn't fix anything;<br>,4
topic8,1.198623,subscription page; cant see; social medium,0,11.39,1: it would be_nice if your next_update allow music to be play without need the_app to be open constantly;<br>2: problem_with_this app be every_time you open a_new mpg the_app change setting to auto which_be 1080dpi chew up all_of your data this be so_stupid because i doubt iphone_or ipad even_support <digit> i_can't see the difference_between 480dpi and any higher i've write to utube assistance on <digit> occasion now and not one reply the setting should stay as you set them not do as they please;<br>3: when_i try open the_app in app_store it's denial;<br>,5
topic8,1.540172,long time; keep get worse; ipad air,0,11.41,1: i have use this_app for very long_time but_now i_cannot even use the_app as it cannot load my_account even i switch account it still_can't load;<br>2: use the_app for_year and it keep_get_worse and worse;<br>3: please_fix_this bug and it would also be_very helpful if_you could_give us an_option_to use an_older_version of the_app;<br>,6
topic8,1.539693,next time; use safari; wont work,0,11.43,1: phone be also run very hot while use the_app;<br>2: the_new_update make the_app so slow and it crash so frequently that i just think_it's honestly a waste_of time;<br>3: i_love the_app but since update the current_version this_app;<br>,7
topic8,1.643749,double tap; keep write; keep crash,0,11.45,1: i_don't_like it because i've be so use to the tab icon be at the_top and now it's be move to the_bottom it's also harder_to see them because_they aren't red anymore and they hide with the_background colour color which_be white;<br>2: the_new_update won't_work and now my app can't_open i_try delete it and download it again but it just_say wait;<br>3: the_bottom tab selection be_horrible move it back_to the way it be which_be at the_top;<br>,8
topic8,1.503429,would rate; pathetic effort; obvious option,0,11.47,1: if i_could_give it a negative score i would;<br>2: i don't_understand_why something like youtube would feel the need_to keep add new_feature;<br>3: look_like whomever design the ui need_to be replace with someone_who understand modern interface design and can_see beyond the exist issue;<br>,9
topic8,1.601444,many people; playback speed; keep press,0,11.47.1,1: also it'd be_great if_you have more control over your channel from the_app i;<br>2: it make me close out the_app and restart;<br>3: every ubdate they do only make the_app worst;<br>,10
topic8,1.807299,message say something; keep get; error message,0,11.49,1: any_video i_click_on it'll give_me_an_error message_say_something go_wrong i_can't_watch anything on the_app;<br>2: i_can't_watch anything i keep_get error_message even_though it's be update what's the_point_of have this_app if i_can actually watch_any_video;<br>3: i_want_to use the_app but i_can't because you aren't let_me;<br>,11
topic8,1.801356,billion dollar; stop work; stop change,0,12.03,1: after this update the_app open but won't_play_any_video;<br>2: multi billion_dollar company and you think_it's a_good idea to not allow audio playback while the_app isn't open on my_screen;<br>3: the_app auto update and now it wont play_any_video;<br>,12
topic8,1.920449,keep press; many bug; search history,0,12.04,1: force low resolution over mobile network make this_app useless;<br>2: also i keep_press the like button but it accidentally make me want_to comment on the comment;<br>3: basically make everything slower significantly and make the view worse;<br>,13
topic8,2.224077,full screen; last time; spring day,0,12.05,1: new_update make it more useless then before;<br>2: also i have_trouble exit from full_screen;<br>3: it would be good if_you_could actually play a_video;<br>,14
topic8,2.260448,single video; terrible layout; spring day,0,12.06,1: i go_to open the_app on_my_phone and my_phone glitched and freeze;<br>2: before this update the_app work_perfectly but_now they screw something up because the_app crash all the time;<br>3: it log_me out when_i first open the_app after the update and every_time_i try_to log_in it_keep_say there's_an_error at this time;<br>,15
topic8,1.359576,cellular data; billion dollar; many bug,0,12.07,1: i delete the_app and_re_download the_app and still not a_single_video will_load;<br>2: after delete the_app and try_to download again it_say the_app be already ready to open;<br>3: the_new_update generally make the_app worse;<br>,16
topic8,1.920526,useless feature; nothing work; stupid message,0,12.09,1: the_app hasn't let_me play_any_video for a_while now how have this not be fix yet;<br>2: fix bug that would be_useful_for a better youtube experience_instead_of fix the one that nobody_care and add useless_feature to the_app;<br>3: fix bug that would be_useful_for a better youtube experience_instead_of fix the one that nobody_care and add useless_feature to the_app;<br>,17
topic8,1.605674,useless feature; ipad mini; multiple time,0,12.10,1: fix bug that would be_useful_for a better youtube experience_instead_of fix the one that nobody_care and add useless_feature to the_app;<br>2: seriously youtube get the_app fix;<br>3: i bet you won't_even read any review from your_user because you care so_much about the money make from add advertisement to the_app;<br>,18
topic8,1.826659,watch anything; several time; stupid message,0,12.11,1: please_fix_this or make a better youtube app;<br>2: you have be work on this_app for <digit> year_and you cant make a simple enjoyable app;<br>3: we_can barely watch_anything on this_app without a stupid_message block our_way;<br>,19
topic9,1.604011,right hand; get stick; billion dollar,0,11.30,1: in the_last_few day since_the latest_up date a_video will_play for_a_few minute and_then all_of a_sudden without_me touch any_video change to another in the list;<br>2: all without_me touch any vid other_than the first one choose and none p age right through;<br>3: then that play for a minute_or so then the video change again to another random vid on the right_hand side recommendation and so it go_on;<br>,1
topic9,1.586465,web browser; use safari; say error,0,11.34,1: also you_need_to change the_comment_section back;<br>2: change the comment style back as_well;<br>3: it's_very_annoy so please_change it back;<br>,2
topic9,1.785724,dosent work; keep write; auto play,0,11.35,1: in the_last_few day since_the latest_up date a_video will_play for_a_few minute and_then all_of a_sudden without_me touch any_video change to another in the list;<br>2: repeatedly get a keep disregard pop_up that_you_can remove and have to restart the_app;<br>3: i_can't get back on my_account;<br>,3
topic9,0.983530,live stream; get stick; wont work,0,11.38,1: when_ever you watch_a live_stream that be finish a_few_hour ago it glitch_out and act_like it be still live but start five second until it's finish;<br>2: when_i try_to watch_a video it will_play until about half_way and_then it will skip the picture to the near the end but the sound will_still be where i be still watch and_then when_i try_to put skip it back_to where i be it just go_to the start;<br>3: honestly do you not test and retest and_then test again to ensure you have cover every possible scenario before_release_an update;<br>,4
topic9,0.948631,try everything; subscription page; use safari,0,11.39,1: i have try_everything well maybe not everything i've turn_off my_ipad and turn it back on i've turn_off my_internet and turn it back on any many_other thing but_nothing work;<br>2: i watch_a video for_a_few minute and turn the screen off for_a_few minute to watch_later;<br>3: serve it basic function well there_be ad but that's alright since it's a free app anyway;<br>,5
topic9,1.582462,home button; find anything; ipad air,0,11.41,1: make_an app of youtube be a_great idea i_think i be_very impress of the neatness and effort they put into it;<br>2: please_fix_this bug and it would also be_very helpful if_you could_give us an_option_to use an_older_version of the_app;<br>3: cause <digit> also mean mature audience it mean m rat;<br>,6
topic9,1.898410,home trend; home page; use safari,0,11.43,1: please_fix_this issue i_don't_like have to get_out_of bed to hop on my_pc and watch youtube;<br>2: you're make the_app look worse and feel worse each_update;<br>3: please_fix_this issue as fast as_possible as i be really get tire_of the_app be unresponsive;<br>,7
topic9,1.554336,double tap; full screen; many people,0,11.45,1: plus if_you back out_of the_app while_watch a_vid in_landscape than go_back into the_app i'm stick_on a_black_screen force me to shut_down the_app entirely and start again;<br>2: kind_of defeat the exact purpose_of the_app;<br>3: it get update and now it crash as_soon_as i_click_on the_app;<br>,8
topic9,2.450602,relate video; side bar; multiple time,0,11.47,1: and sometimes open the_app crash my_phone completely;<br>2: when_ever i_click_on a relate_video the_app crash it be so_annoy pls_fix this_asap;<br>3: whenever_you click_on_a video on the side while a_video be already open the_app crash;<br>,9
topic9,1.614568,keep press; third party; nothing work,0,11.47.1,1: please_fix_this this be like the_main function of the_app and it's break i'm currently use vpn but it shouldn't_be a problem because the connection be there;<br>2: click it to open and the_app drop i have to wait awhile until i_can finally use it without it crash on me;<br>3: hello i this application be_great i just find it a_little bugy for_example i_try to create a chanel to change_my user picture but it do like it go_to open it during like a half second and_then close right back please_fix it thank_you;<br>,10
topic9,1.594925,grey screen; home button; landscape mode,0,11.49,1: i be listen_to_music on youtube like always i go_into another app for not_even a minute i come_back and i_can't play_any_video all it_say be something_go_wrong_tap to try_again;<br>2: can initially connect and start cast but connection be drop within a_couple minute and_then be_unable_to reconnect;<br>3: i've_try_everything and nothing's work please_fix_this;<br>,11
topic9,1.772399,skip thing; home page; double tap,0,12.03,1: but there_be one problem now after apple put out it latest_update youtube have be turn_off it because after awhile of not touch the screen my_device will turn_off but before the update it wouldn't;<br>2: cannot skip_ad please put the skip_button back again;<br>3: there_be delay of a second;<br>,12
topic9,1.607103,background play; major problem; grey screen,0,12.04,1: the_app open_up but won't_play_anything at_all;<br>2: i select a_video and it_say_something go_wrong i've_try every thing please_fix;<br>3: it cut_off a_lot_of content and i be basically unable_to use the_app at_all;<br>,13
topic9,2.026118,watch vids; stop work; full screen,0,12.05,1: leave the_app alone and stop constantly update with useless improvement;<br>2: i uninstalled and instal the_app sign_out of my_account and log_in back then unplug my_wifi_connection then plug in back and it_doesn't_work;<br>3: everywhere you look there's_an advertisement;<br>,14
topic9,1.618009,home page; many time; grey screen,0,12.06,1: when_i tap_on a_video to_watch it it start to load_but then it_say_something go_wrong;<br>2: except turn your_phone off and_then back on;<br>3: a_few problem <digit> home_page will automatically scroll up after i_click_on a_video <digit> the ad be overly repetitive and more often than not with not relevant <digit> i_can't play music in the_background overall the webpage could probably do the job just the_same if not better without have the_app;<br>,15
