key,value,label,emerlabel,version,sent1,num
topic3,1.234124,live stream; get stick; bring back,0,11.38,1: when_i try_to watch_a video it will_play until about half_way and_then it will skip the picture to the near the end but the sound will_still be where i be still watch and_then when_i try_to put skip it back_to where i be it just go_to the start;<br>2: when_i go_on it just_say tap_to relode and when_i do it just_tell_me to it over and over plz_fix now;<br>3: i have be try_to update my youtube since morning and it_seem impossible;<br>,4
topic3,0.996984,slide bar; rewind button; social medium,0,11.39,1: i_can then reply_to your reply from my_first reply_to your reply and_then you_can re_reply so i_can re_reply to your re replay and_then we_can become life time friend because we_have reply and re_reply all_day long;<br>2: i_can_only give it one_star because i_can't reply_to reply_to a reply_to a reply_to a reply_to a reply or even_worse still i_can't reply_to a re_reply;<br>3: sorry no time i get to reply_to a reply;<br>,5
topic3,1.316345,channel art; find anything; ipad air,0,11.41,1: app doesn't f_king work half the time when_i try_to watch_a video it_doesn't even_play fix_your sh_tty app google;<br>2: it's bad_enough that_there_be ridiculous suggest search but to bring_up the hundred_of recently search thing instead be straight stupid;<br>3: and when_i reinstall it still have the_same_problem;<br>,6
topic3,1.413274,get notification; free trial; next time,0,11.43,1: when_i change from landscape_mode back_to portrait my_ipad display get zoom and <digit> <digit> of the screen actually blackout;<br>2: i'm ok with just normal youtube but when_i try_to get the one month free_trial it ask_me on the appstore if i_want_to pay <digit> buck australian;<br>3: my_phone just randomly stop get_notification from the people that i'm_subscribe_to and get the notification for please_fix_this;<br>,7
topic3,1.593038,full screen; top comment; channel art,0,11.45,1: it's bad_enough that_there_be ridiculous suggest search but to bring_up the hundred_of recently search thing instead be straight stupid;<br>2: even_though people don't_like the_new_update i still think_it's a_great app before and still be a awesome app to_watch your vids and even make your_own so i don't_mind it;<br>3: i cannot_play anything on macbook ipad or either of my iphones and i_know i'm_not alone;<br>,8
topic3,2.544343,relate video; side bar; wont work,0,11.47,1: the_new_update make it so every_time_i click a relate_video the_app crash;<br>2: whenever_i click a_video on the watch next tab the_app crash <digit>;<br>3: when_ever i_click_on a relate_video the_app crash it be so_annoy pls_fix this_asap;<br>,9
topic3,2.151772,subscription fee; wont work; use safari,0,11.47.1,1: so one time the_app crash and i relaunched the_app and when_i do the hot bar for the home substrictions etc;<br>2: now i have to make_sure that the_app be close when_ever i leave it or_else it will kill my_battery in no time at_all;<br>3: change_my password a_couple time still keep_say_something_go wrong;<br>,10
topic3,1.281329,nothing happen; message say something; many time,0,11.49,1: this_app use to work_fine_but ever_since i update it when_i try_to open the_app it just crash;<br>2: it's_really_annoy to have to keep it open and have music shut off when_i exit the_app;<br>3: i_want_to use the_app but i_can't because you aren't let_me;<br>,11
topic3,1.264950,nothing happen; wont load; subscription fee,0,12.03,1: whenever_you click_on_a video it_say_something go_wrong click to_retry i've tap a dozen time and nothing_happen;<br>2: video_aren't work when_i click to_watch them;<br>3: while it be still possible to drag the time bar the bar be so small you almost inevitably tap the screen and rewind fat forward;<br>,12
topic3,1.718707,many bug; slide bar; wrong tap,0,12.04,1: youtube crash when_i try_to open it on_my_ipad air_2 run io_10;<br>2: the new scroll_through a_video feature be_terrible when_i forward it go_back youtube seriously;<br>3: when_i want_to_watch a_video the audio doesn't_work;<br>,13
topic3,1.750274,nothing happen; keep crash; stop work,0,12.05,1: i_can't_even open the_app because when_i click the icon nothing_happen and i'm on_ipad_mini <digit> with io ten;<br>2: the_app doesn't crash but when_i click i video to_watch it do_not_play at_all;<br>3: now every_time_i try_to open the_app it go vertical and it completely freeze i_can't do_anything;<br>,14
topic3,1.591387,home page; single video; free time,0,12.06,1: it log_me out when_i first open the_app after the update and every_time_i try_to log_in it_keep_say there's_an_error at this time;<br>2: before this update the_app work_perfectly but_now they screw something up because the_app crash all the time;<br>3: video arent load and when_i go_to open a description the_app crash;<br>,15
topic3,1.903742,wont load; get notification; get stick,0,12.07,1: i just tap_on the thing to open the description and the_app randomly crash;<br>2: if_you load the comment on a_video and_then tap_on view_all comment the_app instantly crash;<br>3: i be a dig fan_of youtube and also upload every now and_then and i_can't now because it wont_load it_say in offline when_i can clearly see i'm online;<br>,16
topic3,2.145145,playback issue; scrub bar; dosent work,0,12.09,1: for two day now any time i_try to_watch a_video it_say_something go_wrong_tap_to retry;<br>2: it_say unavailable when_i tap_on a_video and i like love_youtube_but now i_can't_watch anything for a_long_time;<br>3: so_many pop_up can't_even click_on_a song when_i can click_on_one it_doesn't load;<br>,17
topic3,1.681311,playback issue; multiple time; useless feature,0,12.10,1: can never watch_any_video because the_app crash every_minute a_video have play;<br>2: it only crash when a_video be play which_be the_main functionality of the_app so fix_it;<br>3: ever time i_click_on a_video it load for a second_then it_say_something go_wrong;<br>,18
topic3,1.661446,comment section; several time; say something,0,12.11,1: <digit> of the time i_click_on a_video it's crash the_app plus there's so_much ad i_don't_know if that's the publisher ad or youtubes ad please_fix i'm get tire_of this;<br>2: every_time_i open a_video it_say_something go_wrong_try_again;<br>3: before i update this_app the_app be work_perfectly_fine and now every_time_i play a_video within the first few_second of play the video it instantly crash;<br>,19
topic4,1.556543,keep crash; long time; get stick,0,11.30,1: youtube be suppose_to be a free app for people to_watch their favourite youtuber but_now you have to pay to_watch a_bunch_of stuff;<br>2: seriously when_you have idiot spamming you on_facebook or someone you_can't exactly ingore for_a_bite it's kinda stupid how you cant put your_phone on silent to_watch youtube i swear it so_stupid;<br>3: some_people prefer their volume to be of a_certain level;<br>,1
topic4,1.241517,offline mode; web browser; use safari,0,11.34,1: there a_bug_where when_i zoom into a_video and cant zoom back out and when_i click_on_a channel in_my_subscription it doesnt open;<br>2: when_i go in to the_app it_say_error or offline and that sucke;<br>3: i_can't reply_to a person_who comment on someone original comment i_can_only reply_to the_original comment please_fix_this when_i like a_video and_then click off the video and_then click_on it again my like be go when_i give a_video a thump up or a dislike after i refresh the page the like be go;<br>,2
topic4,2.964530,many people; web browser; home page,many people; sub box; top comment,11.35,1: do consider get an_ad blocker if_you use this_app to spare you from any headache it will undoubtedly cause;<br>2: many_people use this_app and it the most common platform_for people to use to_watch video so please review this as_soon_as_possible;<br>3: would highly appreciate an_update soon i use youtube for education purpose if_you're wonder;<br>,3
topic4,1.121866,wont work; get stick; bring back,bring back; get stick; wont work,11.38,1: with the_new_update i_can't_even play a_video it stay_on one frame and won't continue;<br>2: i've_try restart_my_phone restart the_app pause and play the ad redownloading the_app and watch different video;<br>3: every_time_i play a_video it load_but doesn't_play;<br>,4
topic4,1.596210,multiple time; pause button; social medium,0,11.39,1: literally just this patch when_i go_to play a_video it will_load_but it won't_play;<br>2: g when_i be sigh into my second account and upload a_video it upload on my_first account instead even_though i be sigh out_of_my first_account;<br>3: whenever_i_go click a_video it_doesn't play_at_all;<br>,5
topic4,1.523579,home button; keep get worse; long time,0,11.41,1: on_an_iphone <digit> plus the_app will murder your battery every_time if_you pause a_video and hit the home_button;<br>2: app freeze after i pause a_video and wouldn't resume;<br>3: please_fix it so when_i click a youtube link_in the description_of a_video it_take me straight to that video instead_of the internal browser safari open youtube;<br>,6
topic4,1.843102,channel art; use safari; cellular data,0,11.43,1: i still use iphone_4 and now i_can't use this_app;<br>2: please_fix the_app i use to use it everyday;<br>3: this be the worst_update youtube be really_slow and complicate and i_can't use it please_get_rid of the_new_update;<br>,7
topic4,1.516448,top comment; portrait mode; full screen,0,11.45,1: when_i try_to play a_video it click it but only go 1_second in then freeze;<br>2: when_i want_to_watch a_video it load_but won't_play;<br>3: when_i turn_my_phone from landscape to portrait_mode when_i'm do with a_video it sometimes stay in_landscape but only half_of the screen;<br>,8
topic4,1.753413,keep crash; third party; pathetic effort,0,11.47,1: fix and i might use the_app again;<br>2: i_love_youtube but the_app need plenty of work it_seem now everybody have their_own problem won't_let_me sign_in won't_let_me search something my problem be that the video stay permanently pause so for now unusable wake_up google fix_this every like you now keep this reputation and fix youtube;<br>3: nice finally fix the banner problem;<br>,9
topic4,1.931437,many time; ten second; many bug,0,11.47.1,1: these couple_of thing be what have stop me from use this_app so it would be_great if_you_could fix them thank;<br>2: it ain't my connexion that have a problem so please_fix your_app;<br>3: if_you add comment notification then i'd say this_app would finally be worth 5_star as_long as you don't change anything_else;<br>,10
topic4,1.469330,home button; download quality; default download quality,0,11.49,1: when_i tap a_video it_say that something be wrong plz_fix it;<br>2: whenever_i_try to_watch a_video it_say_error tap_again to_retry and when_i tap it it_say the_same_thing over and over;<br>3: whenever_i_try to play a_video it will just_say that something_go_wrong and to tap_to_retry;<br>,11
topic4,2.036779,pause button; party apps; stop work,0,12.03,1: hey guy this be a_big problem whenever_i_press on a_video it will_not_load plz_fix and take away that stupid 10_second ahead thing i always press it by_accident it so_annoy plz_fix_this;<br>2: get_rid_of the feature be you double_tap_to go forward_or_backwards <digit> of_people hate this;<br>3: i_hate the feature that skip or rewinds the video by_10_second;<br>,12
topic4,1.511603,try delete; wont play; dosent work,0,12.04,1: everysense the_new_update video wont_play i even try_delete the_app and go_on safari it dosent_work either please_fix it till now i have to_watch tv;<br>2: since_the latest_update i_can even access into the_app;<br>3: i_cannot even use the_app since_the last_update;<br>,13
topic4,1.698045,something's wrong; watch vids; double tap,0,12.05,1: it_doesn't give_me any_problem not as_much as this_app do i_think the_app be suppose_to be better i give it four thumb down;<br>2: this_app better get it act_together;<br>3: whenever_i_try to_watch a_video it_say there's_an_error;<br>,14
topic4,1.935987,grey screen; double tap; terrible layout,0,12.06,1: the youtube be keep_crash thank to the update please_fix;<br>2: youtube log_me out_of_my_account and won't make me log_back in and when_i double_tap a side to skip 10seconds it_doesn't_work like what the_hell man;<br>3: sign back in and even my_profile be all mess_up lose_my pic and all_my comment history;<br>,15
topic4,1.587050,stupid message; watch anything; third party,0,12.07,1: i'm never use this_app again;<br>2: oh my god now we cant pause or play use our earpods omg google fix_ur stuff don't make it worse;<br>3: i would_like to_see this_app back and operate as it use to be and i don't_mind those format change as_long as future update provide a better and more reliable platform to_watch entertainment;<br>,16
topic4,1.891186,useless feature; live stream; watch anything,0,12.09,1: i bet you won't_even read any review from your_user because you care so_much about the money make from add advertisement to the_app but why_can't you just add a 5_second_skip button to every ad and also put an_ad_at every_single_video;<br>2: youtube need_to make this_app better again;<br>3: i bet you won't_even read any review from your_user because you care so_much about the money make from add advertisement to the_app;<br>,17
topic4,1.910847,error message; wifi connection; bug fix,0,12.10,1: all that occur be a brief buffer follow by the error_message something_go_wrong please_try_again later;<br>2: why the_heck do you put <digit> and 30_second advertisement without_any 5_second_skip button at_every_single f_cking video that i_try to_watch;<br>3: i use to love_youtube_but now whenever_i_try to_watch a_video it_say_sorry something_go_wrong;<br>,18
topic4,1.448962,keep crash; say something; web browser,0,12.11,1: never think i would be say this but;<br>2: so the notification hub be a bother as i don't get email from youtube but google now and that's crap have to change email filter and there_be_no clear way_to disable in app response to just go_back_to your email;<br>3: try_to drive in the car use my_data to listen_to_music and youtube have a 15_second commercial after every song;<br>,19
topic5,1.301483,get stick; make money; keep crash,background play; web browser; several time,11.30,1: <digit> mental autistic monkey could code a better app than this sluggish bloat junk that lock background_play behind youtube_red which_isn't even available_in canada yet;<br>2: le pub sont rendus de plus en plus nombreuses;<br>3: i don't have youtube_red and i_can't_watch any_video on this_app;<br>,1
topic5,1.591228,web browser; use safari; make sense,0,11.34,1: i now can not download it back on to my_phone;<br>2: change the comment style back as_well;<br>3: also you_need_to change the_comment_section back;<br>,2
topic5,1.769391,comment thread; right hand; dosent work,0,11.35,1: with multiple bug and issue that make the_app bad;<br>2: nothing in term of my_internet have change other_than the_app itself;<br>3: some issue that i have encounter have make the_app worse_than it be before;<br>,3
topic5,1.318091,take age; bug fix; get stick,0,11.38,1: i_try delete the_app and download it again but it didn't fix anything;<br>2: everytime_i want_to_watch a_video i_cant_watch it because it be the_whole time on pause and i_cant get it on play help_me pls;<br>3: this_app have an_update and wouldn't do the update i've now delete the_app and now i_can't download it this be_really_annoy;<br>,4
topic5,0.996984,slide bar; rewind button; social medium,0,11.39,1: problem_with_this app be every_time you open a_new mpg the_app change setting to auto which_be 1080dpi chew up all_of your data this be so_stupid because i doubt iphone_or ipad even_support <digit> i_can't see the difference_between 480dpi and any higher i've write to utube assistance on <digit> occasion now and not one reply the setting should stay as you set them not do as they please;<br>2: <digit> rewind_button the slide_bar be hard_to use to rewind short time on long clip;<br>3: i've have to delete the_app and redownload it more_than <digit> time over the_past_few day;<br>,5
topic5,1.540172,long time; keep get worse; ipad air,0,11.41,1: i_try delete and_reinstall the_app but that do_nothing;<br>2: so i_try to log_in with my_account and i_can't log_in i_try delete it to fix the problem but it_doesn't do the trick;<br>3: i_try use this keyboard on youtube but i_cant reply_to anyone because_of this_bug;<br>,6
topic5,1.598723,next time; fix something; use safari,0,11.43,1: i have try restart_my_ipad turn my_wifi on and off again and even delete the_app;<br>2: stop wreck the_app with a whole bunch_of feature no one ask_for and fix the problem that arise;<br>3: cant_watch_anything even after i update the_app;<br>,7
topic5,1.467522,live stream; sub box; many people,0,11.45,1: it would be_great if google could live_stream all free to air tv channel from various country so that their respective citizen could chromecast to tv screen if_they be stay overseas;<br>2: the_new_update won't_work and now my app can't_open i_try delete it and download it again but it just_say wait;<br>3: i'm on a older iphone and i_can't_even download a older_version smh;<br>,8
topic5,1.282482,mise jour; try delete; background playback,0,11.47,1: depuis <digit> semaines je n'arrives pa regarder de vid_os sur youtube et pourtant ma copine qui a le m_me t_l phone que moi y arrive sans probl me;<br>2: je ne peux plus utiliser youtube car la mise_jour <digit> d cembre <digit> ne se t_l charge pa;<br>3: fix that and you get <digit> five_star;<br>,9
topic5,1.305102,sub box; wifi connection; multiple time,0,11.47.1,1: if this doesn't get fix i'll probably delete the_app;<br>2: how come i have the_latest_version but have to delete the_app and_reinstall to get this magnificent new ui and a sub_box that actually_work;<br>3: i've_try to fix_it by restart the_app restart_my_phone log_out and back_into youtube on the_app and delete and_reinstall the_app;<br>,10
topic5,1.725535,nothing happen; bug fix; keep say,0,11.49,1: consider the_whole point_of the_app be to_watch youtube i will be delete this_app if this do_not get fix;<br>2: i_want_to use the_app but i_can't because you aren't let_me;<br>3: i delete and_reinstall the_app and it do_nothing;<br>,11
topic5,1.801356,stop work; billion dollar; stop change,0,12.03,1: the control be clunky and hard_to use;<br>2: it's horrible it's_hard to get use to and more complicate;<br>3: once we get use to one interface it change again;<br>,12
topic5,3.049893,background play; bring back; say something,wont play; dosent work; try delete,12.04,1: ever_since_the new_update i_can't load vedios at_all;<br>2: edit a restart of the phone resolve the problem;<br>3: i_can't understand_why the change of the way you view video be so important l;<br>,13
topic5,1.917297,last time; spring day; stop work,0,12.05,1: i just get the_latest_update on_my_iphone 7s with plenty of space leave and glitching and buffer i use to read the review and not care until i get this update this be a_good app just don't get the_latest_version you will definitely regret it;<br>2: i kindly request to get this fix;<br>3: video get choppy randomly after some use;<br>,14
topic5,2.558753,mise jour; spring day; keep get,0,12.06,1: le pub ont ne peut m_me plus le passer et j'ai perdu mon compte youtube et impossible_de le r cup rer;<br>2: so i be delete this_app and will use youtube browser until it get fix as this be garbage for_me;<br>3: the new_version and new_update that be to fix bug do_nothing but add more_bug and even_worse one;<br>,15
topic5,1.291597,next time; search bar; major problem,0,12.07,1: dont break what didnt need fix;<br>2: each_time an_update come_out stay it's to fix bug;<br>3: google be mean to be one_of the_best tech company in the_world shouldn't_be hard_to fix an_app that_wasn't break before;<br>,16
topic5,1.807589,useless feature; internet connection; use safari,0,12.09,1: don't update an_app if_you can't fix the bug problem;<br>2: i've_see earlier review describe this_problem but after several update no fix have be make;<br>3: this latest_update have completely trash the youtube app what sort of quality control do you have when_you fix a_small problem and completely wreck the_rest_of your product get some decent coder and improve your qa;<br>,17
topic5,1.651578,background playback; useless feature; multiple time,0,12.10,1: it won't get me re_download and i_can't delete it;<br>2: when try_to change brightness or whatever it get pull up as_well;<br>3: seriously youtube get the_app fix;<br>,18
topic5,2.083905,background play; web browser; bug fix,background play; web browser; several time,12.11,1: <digit> mental autistic monkey could code a better app than this sluggish bloat junk that lock background_play behind youtube_red which_isn't even available_in canada yet;<br>2: le pub sont rendus de plus en plus nombreuses;<br>3: i don't have youtube_red and i_can't_watch any_video on this_app;<br>,19
topic6,1.567072,billion dollar; get stick; keep crash,keep get; say something; watch anything,11.30,1: not a_single_video play due_to the_same error_message pop_up over and over;<br>2: no video be play anymore and i keep_get the message_something_go wrong;<br>3: i_can't_even play_any song on_my_phone or my itunes song i_want my <digit> dollar back because i_can't_even play my song i buy on itunes;<br>,1
topic6,1.586465,say error; web browser; use safari,0,11.34,1: i attempt_to view_any_video all i get be a_message at_the_bottom that say_error while load video what's the_point_of have youtube if_you cannot_even view anything in_my_subscription;<br>2: i don't have a issue_with the youtube app it's great_app and i've be enjoy the recent_update to it but this new_one be just bad i'll be specific the_comment_section be bad because it look awful just try_to see more reply send_me to some dumb sub page and again it look awful hopefully the_next_update return_to the previous one;<br>3: dan howell might be no_more in a_week if_u don't;<br>,2
topic6,2.195462,would rate; keep write; sub box,0,11.35,1: please_fix your s t asap please it's f g annoy;<br>2: please_fix as i watch a_lot_of live_stream;<br>3: repeatedly get a keep disregard pop_up that_you_can remove and have to restart the_app;<br>,3
topic6,1.223582,get stick; bring back; bug fix,0,11.38,1: it happen since_yesterday and it work at time but most_of_the time it_doesn't play anything please_fix it;<br>2: youtube please_fix you_guy actually listen_to review;<br>3: it's happen to a_lot_of people i_know and now it's just annoy;<br>,4
topic6,1.435363,social medium; use safari; cant see,0,11.39,1: this social_medium egocentric stick your nose into everyone el business chat bull intrude into almost_every app and into almost_every part_of our live should_be a psychological worry to all intelligent people;<br>2: hello i_love_youtube and it's great to have it on_my_ipad and i_know that_there_be gonna be a_few bug most_of_the bug this_app have doesn't really effect me but after the_new_update there's one that do;<br>3: and also give_us a way_to change thumbnail on_io or_at_least a quick way_to get to desktop mode;<br>,5
topic6,1.595718,find anything; ipad air; long time,0,11.41,1: ever_since i get the_new_update video_won't_play;<br>2: when_i search stuff and more and more it's_annoy it stay_there and i wanna get it remove private stuff i do but i don't_want anyone to_see it you know_what i mean;<br>3: ever_since_the new_update_come_out reply_to your comment don't_show_up you_need_to go_to another_page just to look_at comment when_you click a link you have to go_through multiple website before you get to the proper website and sometimes this doesn't_even happen;<br>,6
topic6,1.582561,next time; use safari; home page,0,11.43,1: in this most_recent_update you have make the different tab at_the_bottom instead_of the_top;<br>2: you're make the_app look worse and feel worse each_update;<br>3: the tab for home hot video and fee at_the_bottom make it worse to use and not_be_able to swipe_between them;<br>,7
topic6,2.073213,keep get; playback error; keep crash,0,11.45,1: can_you please_fix the new bug_where you want_to load a_video than it load_but it_doesn't load and it make me really angry;<br>2: stop add stuff that isnt need make the_app more complicate and more crashy;<br>3: please_fix it banner and profile picture make a channel good;<br>,8
topic6,2.854622,double tap; auto play; background playback,0,11.47,1: need major work who ever make this update need_to be fire;<br>2: other_than the crash it work ok;<br>3: just remove auto_play or let_us turn it off permanently;<br>,9
topic6,1.912424,third party; drain battery; keep say,0,11.47.1,1: the_app have be update yet there_be feature on_my_iphone <digit> that work on it and not my_ipad <digit>;<br>2: so i delete your_app i_know <digit> people i talk to in twenty min do the_same;<br>3: there_be more 30_second_ad then <digit> or <digit> and can't_skip anymore;<br>,10
topic6,1.865568,error message; keep get; internet browser,0,11.49,1: when_i keep go_into the fuken app it isnt work since this stupid_update fix_this now im get so board so fuken fix_it;<br>2: okay youtube i'm_sick_of this_app be all_buggy this_app will_not_load anything and everything be just all_buggy i sick_of_this so fix_this;<br>3: please_fix app it have get bad after previous_update;<br>,11
