key,value,label,emerlabel,version,sent1,num
topic3,1.596210,multiple time; pause button; social medium,0,11.39,1: when_i try open the_app in app_store it's denial;<br>2: why should i have to pay_for a subscription to listen_to the audio of a_video if the_app be in the_background;<br>3: literally just this patch when_i go_to play a_video it will_load_but it won't_play;<br>,5
topic3,1.419218,home button; keep get worse; search history,0,11.41,1: i_try delete and_reinstall the_app but that do_nothing;<br>2: i_try reinstall the_app but it_doesn't_work;<br>3: on_an_iphone <digit> plus the_app will murder your battery every_time if_you pause a_video and hit the home_button;<br>,6
topic3,1.539693,use safari; next time; wont work,0,11.43,1: stop add feature in update and fix the_app;<br>2: it happen on every_video with add on it so please_fix the thing that be break with the_app before you add_more crap to the_app;<br>3: flood with add get beyond the joke the one where_you_can skip after 5sec be_fine_but the <digit> 30sec add be a head fck also how_do you see where_you comment on a_video;<br>,7
topic3,1.457102,night time; pathetic effort; obvious option,0,11.45,1: i_can't stream anything at the moment because_of this_bug;<br>2: even_though people don't_like the_new_update i still think_it's a_great app before and still be a awesome app to_watch your vids and even make your_own so i don't_mind it;<br>3: if i_want_to watch_a post stream it play for a_couple_of second_then restart give another add then play for another couple second and do it again;<br>,8
topic3,2.271425,relate video; wont work; wrong tap,0,11.47,1: whenever_you click_on_a video on the side while a_video be already open the_app crash;<br>2: whenever_i click a_video on the watch next tab the_app crash <digit>;<br>3: lose_all my relate_video and most_of_the time it crash after a_video;<br>,9
topic3,2.780655,full screen; try delete; next time,0,11.47.1,1: so one time the_app crash and i relaunched the_app and when_i do the hot bar for the home substrictions etc;<br>2: a_lot_of time when_i make a_video full_screen it_won't_let me go_out_of that mode unless i close the_app and open it again;<br>3: also 99_of the time when_i click to come_out of full_screen it get_stick_in_full screen and i have to_close the_app to get un stick;<br>,10
topic3,1.423651,home button; nothing happen; fix something,0,11.49,1: whenever_i_try to_watch a_video it_say_error tap_again to_retry and when_i tap it it_say the_same_thing over and over;<br>2: whenever_you can't_watch a_video or whenever it_say tap_to_retry or_something i forget the exact word press and hold the power and home_button to do a hard reset after the phone_restart you_should be_able_to watch_any_video without have issue hope this help;<br>3: when_i tap a_video it_say that something be wrong plz_fix it;<br>,11
topic3,1.872194,nothing happen; wont load; party apps,0,12.03,1: a_lot_of time i open youtube and load a_video and it_doesn't_work it_say tap_to_retry even_though i'm_connect_to internet;<br>2: whenever_you click_on_a video it_say_something go_wrong click to_retry i've tap a dozen time and nothing_happen;<br>3: while it be still possible to drag the time bar the bar be so small you almost inevitably tap the screen and rewind fat forward;<br>,12
topic3,1.562049,wrong tap; say something; dosent work,0,12.04,1: this_app use to work_fine_but ever_since i update it when_i try_to open the_app it just crash;<br>2: when_i press one it_say_something go_wrong_tap_to retry and i tap it and it_doesn't_work;<br>3: the only nice thing_about this update be the new look when_i click to view my library;<br>,13
topic3,1.394664,nothing happen; something's wrong; full screen mode,0,12.05,1: now every_time_i try_to open the_app it go vertical and it completely freeze i_can't do_anything;<br>2: the_app doesn't crash but when_i click i video to_watch it do_not_play at_all;<br>3: i use to spend lot_of time on youtube but with the_new_update i_can't log_into my_account when_i do try_to log_in it express an_error that i do_not know_how to fix;<br>,14
topic3,2.061197,home page; nothing happen; keep get,0,12.06,1: it log_me out when_i first open the_app after the update and every_time_i try_to log_in it_keep_say there's_an_error at this time;<br>2: when_i open a_video on the youtube app it_doesn't_work;<br>3: video arent load and when_i go_to open a description the_app crash;<br>,15
topic3,1.293075,get stick; nothing happen; many bug,0,12.07,1: after delete the_app and try_to download again it_say the_app be already ready to open;<br>2: i delete the_app and_re_download the_app and still not a_single_video will_load;<br>3: every_time_i open the_app when my_screen rotation be lock horizontally it give vertical screen;<br>,16
topic3,2.521714,useless feature; nothing work; playback issue,0,12.09,1: over the_last week it's be crash every_single_time i open the_app usually after about 30_second of be open;<br>2: for two day now any time i_try to_watch a_video it_say_something go_wrong_tap_to retry;<br>3: whenever_i turn on a_video youtube crash;<br>,17
topic3,1.602549,try reinstall; playback issue; multiple time,0,12.10,1: it only crash when a_video be play which_be the_main functionality of the_app so fix_it;<br>2: can never watch_any_video because the_app crash every_minute a_video have play;<br>3: every_time_i try_to load a_video it_say_something go_wrong;<br>,18
topic3,1.482836,several time; comment section; keep write,0,12.11,1: <digit> of the time i_click_on a_video it's crash the_app plus there's so_much ad i_don't_know if that's the publisher ad or youtubes ad please_fix i'm get tire_of this;<br>2: every_time_i open a_video it_say_something go_wrong_try_again;<br>3: it happen_a_few time already the_app crash when_i want_to look_at the description_of the video i be watch;<br>,19
topic4,1.596244,audio keep; right hand; long time,0,11.30,1: two problem i have with this_app <digit>;<br>2: and to get_rid_of these recommendation a tiny button on the side which have <digit> <digit> chance of actually touch it to press not_interest;<br>3: this be the only problem i have with the_app and have be use it for_about <digit> year now;<br>,1
topic4,1.524503,web browser; use safari; whats wrong,0,11.34,1: <digit> but still can be download with io_7;<br>2: <digit> before i_can download youtube again;<br>3: <digit> but_now it_say i need_to upgrade to io_8;<br>,2
topic4,2.195462,sub box; keep write; would rate,0,11.35,1: the follow necessity have be remove for this reason <digit> easily reply_to comment while still watch the video <digit> reply_to specific people <digit> not have to load an entirely new_page just to_see a comment's reply <digit> not get cancer if_you have_any issue feedback the f you;<br>2: how_about you actually allow_us to remove channel in our sub_box when the channel be not active like completely be deactivate i've get like <digit> or so dead channel in my_sub_box and i_can't remove them;<br>3: when_i run speed test on_my_ipad i get <digit> down really stable connection too;<br>,3
topic4,1.252373,subscription list; get stick; take age,0,11.38,1: youtube have always be a_great application for watch video until a_few update_ago about <digit> minute into the video the footage would start again but the audio would countinue;<br>2: it's <digit> and we still_can't choose stream quality_over cellular connection;<br>3: wifi speed from ipad be <digit> to 150mbps;<br>,4
topic4,0.824343,slide bar; rewind button; cant see,0,11.39,1: i have_no idea what connection problem it's refer to since there_be_no problem_with my_wifi and i_can still browse the_app;<br>2: youtube since_the new_update the video want play if_you_don't fix_it problem i will die it early in the morning i be so excite because today some_of my_favourite video just when up so plz_fix as_soon_as_possible no fix_it right_now but i_love_youtube but not this time;<br>3: i_can still load video since_the update unlike a_lot_of other_people however occasionally i_cannot load a_video because_of connection problem;<br>,5
topic4,1.582462,home button; find anything; ipad air,0,11.41,1: when_i search stuff and more and more it's_annoy it stay_there and i wanna get it remove private stuff i do but i don't_want anyone to_see it you know_what i mean;<br>2: as i say i_cant update so now i_cant get it;<br>3: get someone to test it before_release it;<br>,6
topic4,1.892749,multiple time; channel art; free trial,0,11.43,1: every_time_i try_to upload a banner it_say fail_to upload channel_art please_try_again;<br>2: i'm ok with just normal youtube but when_i try_to get the one month free_trial it ask_me on the appstore if i_want_to pay <digit> buck australian;<br>3: try sign_in multiple_time every_time_i try_to sign_in it_say there seem_to_be a problem please_try_again later;<br>,7
topic4,2.295705,playback error; keep get; sub box,0,11.45,1: spend literally a_week on the phone to my_internet provider because i_couldn't get any_video to load and i_think it be my_wifi;<br>2: keep_get playback_error and just spin and not load;<br>3: my app will simply just load with_no minimise button to get out and no load bar fix_this_please;<br>,8
topic4,1.426171,live stream; would rate; keep crash,0,11.47,1: fix that and you get <digit> five_star;<br>2: and also_why would you make youtube <digit>;<br>3: your update be wonderful as i_couldn't change_my banner but a bug have show_up some_of the video have live_stream chat log pull up not let_you click anymore vidoes it would be_great if_you_can fix_this as it have occeared with me and it do seem_to crash when_you choose a relate_video and it do get annoy if_you_can please try and fix_it but ur app be awesome;<br>,9
topic4,2.308133,scrub bar; audio keep; third party,0,11.47.1,1: every_time_i go_to play a_video or song on youtube it come_up_with an_error every_time even_when i be use wifi or 4g with the_latest_update;<br>2: these couple_of thing be what have stop me from use this_app so it would be_great if_you_could fix them thank;<br>3: every now and_then a_video will_just_freeze while the audio_keep play or when_i try_to go_to a_certain part_of the video use the scrub_bar it just go_to the exact same part_of the video no_matter_where on the scrub_bar i release;<br>,10
topic4,2.578178,full screen; connection error; play button,0,11.49,1: the video time be not count up anymore and be stay_at <digit> when the video be play and ad that_you_can usually skip won't_let you because it's_not count down from 5_second;<br>2: when the video i'm watch_a video half_way_through it freeze for_about <digit> minute then start play again sometimes it_doesn't play_at_all and i have to_close the tab and re_open it again;<br>3: take 10_minute to upload <digit> of a <digit> minute video;<br>,11
topic4,2.915834,party apps; audio continue; what's wrong,party apps; stop change; stop work,12.03,1: i be not a_big fan_of this new_update i have skip so_many 10_second with that new_feature and i_don't_like it;<br>2: this new_update be annoy and pointless;<br>3: every_time_i open_up the quality tab i have to scroll_down before u didnt good update just small tweak to make better and it also feel very_slow;<br>,12
topic4,2.360541,say something; background play; wrong tap,say something; wrong tap; tap twice,12.04,1: this_app use to work_fine_but ever_since i update it when_i try_to open the_app it just crash;<br>2: the_only_reason i still use my_ipad be for this_app;<br>3: give it a <digit> cause not buggy at_all and very_convenient and simple to use;<br>,13
topic4,2.057053,full screen; nothing happen; keep crash,0,12.05,1: ever_since i update youtube it's no_longer compatible with my_ipod <digit> even_though the detail say io_8_or later i be on_io_10;<br>2: ability_to thumb up or down <digit>;<br>3: for_example i scroll past a jenna marble video then i scroll and pass <digit> video and click_on_a shane dawson video i make it full_screen then after i close the video i'm somehow back up to the jenna marble video;<br>,14
topic4,2.119407,home page; single video; keep get,0,12.06,1: <digit> min of usage on charge and ive lose about <digit> of battery;<br>2: a_few problem <digit> home_page will automatically scroll up after i_click_on a_video <digit> the ad be overly repetitive and more often than not with not relevant <digit> i_can't play music in the_background overall the webpage could probably do the job just the_same if not better without have the_app;<br>3: however the_newest_update <digit> feb <digit> be horrendous;<br>,15
topic4,2.796420,get notification; ipad air; full screen mode,0,12.07,1: but since_last_update get <digit> notification banner at the_top for each new alert;<br>2: i give <digit> because if this be yt then i'm mad at them;<br>3: i've do a count and in 2_week i have to reset myapple ipad_air <digit> time to get_out_of full_screen_mode and watch more video so i_can get an education;<br>,16
topic4,1.792008,subscription list; use safari; would rate,0,12.09,1: omg <digit> update now and still not_work;<br>2: the screen keep_on say_something_go_wrong tap_to_retry i tap but the screen be still the_same for <digit> day ipad_air_2 plez fix_it;<br>3: i just have a so call update of this_app but when_i wnet to my_iphone be still show old_version <digit>;<br>,17
topic4,1.493119,bug fix; wifi connection; ipad mini,0,12.10,1: it's take_up storage on_my_phone and i_can't_even use it;<br>2: use iphone_6s fully up to date;<br>3: your update say bug_fix but it lie;<br>,18
topic4,1.398730,background play; nothing happen; bug fix,0,12.11,1: this have be happen to me for <digit> <digit> day;<br>2: every_video i watch will_play for like <digit> second and it will buffer for almost <digit> minute before it play for_a_few second;<br>3: i_can't_even play_any song on_my_phone or my itunes song i_want my <digit> dollar back because i_can't_even play my song i buy on itunes;<br>,19
topic5,1.309564,get stick; make money; long time,0,11.30,1: pretty bad app in some respect but it's youtube so i_can't bag it out too_much since i use the_app heap but my advice be to release the monkey you're use to update this_app back_into the wild and hire some human developer for the_app;<br>2: pretty bad app in some respect but it's youtube so i_can't bag it out too_much since i use the_app heap but my advice be to release the monkey you're use to update this_app back_into the wild and hire some human developer for the_app;<br>3: visual sometimes black out generally a frustrate and unpleasant experience to use the_app but i don't have a choice but to use it so;<br>,1
topic5,1.314862,wifi connection; say error; last time,wifi connection; say error; last time,11.34,1: hi my name be ms yvettemarie and when make my review i'm go_to be_honest and upfront cause that's what i do always honest with people yeah tell em straight me best way_to be i_reckon and the truth be i_reckon youtube be pretty slack because when_i try_to load a_video it_take a_good 10_minute to load and i_reckon it can't be issue_with my_wifi because i always_have sufficient wifi and so i'm guess the issue must_be on youtube's side which_be a_bite unfortunate because youtube as a very proud very strong black woman who descend from be part aboriginal malaysian and although very proud of my malay heritage i identify as be aboriginal very proud of my race and where i come_from and i only access your channel to educate myself on my wonderful history and culture of indigenous australia but i have to say i'm quite disappoint when your video take_forever_to load and so i would please ask that you rectify any issue you may_be encounter on your end thank so_much and overall i_reckon your_app be marvellous despite the problem i encounter try_to get the video to load so good one thank guy;<br>2: thank_for make it impossible_to direct reply_to a user what's the_point_of even have a forum that restrict you to just make random comment;<br>3: i attempt_to view_any_video all i get be a_message at_the_bottom that say_error while load video what's the_point_of have youtube if_you cannot_even view anything in_my_subscription;<br>,2
topic5,3.316959,live stream; relate video; right hand,live stream; relate video; keep write,11.35,1: sometimes_when watch video of previous stream after about <digit> sec it reset to the start of video;<br>2: when_i try_to watch video the ad and the video won't actually play;<br>3: every_time_i watch an upload stream it keep_on go_back_to the start of the video;<br>,3
topic5,1.466969,bring back; get stick; take age,0,11.38,1: whenever youtube release_an update the state of use wifi to stream video on the youtube app be so compare to other_apps on the ipad;<br>2: also on that note as a red subscriber why_can't i save my video at 1080p even_though i_can stream them over wifi at that resolution;<br>3: im not_sure whether it's only me or if other_people be experience the_same_problem but all the video in youtube doesn't_play;<br>,4
topic5,1.596210,multiple time; pause button; social medium,0,11.39,1: ever_since that new_update_come_out the video be all load everything work but it_doesn't_work so please do_something about it even my_friend experience the_same_issue so i'll_give it 1_star;<br>2: can't_play video but the load seem smooth please_fix_this_asap;<br>3: after_update i_could watch video only for_a_few time and later on all video could be load properly but the video continue_to be_stick_at <digit>;<br>,5
topic5,1.313007,channel art; long time; find anything,0,11.41,1: do the people_who work at youtube even use their_own app;<br>2: this way involve about <digit> extra click and only sometimes work;<br>3: i've_delete the_app and re_instal it turn_my_phone on and off aeroplane mode retard my router and nothing_seem_to work;<br>,6
topic5,1.457686,double tap; get stick; cellular network,0,11.43,1: since_the new_update my video haven't_be_able to play they load up fine_but just don't_play;<br>2: i would click_on the video it would load in the thumbnail i'd press play and nothing would happen;<br>3: if i move it forward then it would show_me the image of the video in that second and it_doesn't play;<br>,7
topic5,1.585383,top comment; wont load; night time,0,11.45,1: i update because the release note promise that thumbnail of partially watch video would show how far in i previously watch;<br>2: most video remain on the load screen;<br>3: i would click_on the video it would load the video but it would just_stick;<br>,8
topic5,2.771909,scrub bar; auto play; side bar,0,11.47,1: since_the update no video be load;<br>2: since_the new_update there_be_no recommend video in the side_bar when_you watch_a video;<br>3: since_the last couple_of update the_app be almost constantly_crash and the video either take for ever to load or they just don't_load altogether;<br>,9
topic5,2.858648,try delete; internet browser; use safari,0,11.47.1,1: now i'm_not_sure if it just me but my video keep comming up with the_same_message somthing_go_wrong tap_to try agian and no_matter_how_many time i_try to get it to work it just_keep come_up hell i've even try_delete the_app and redownload it and that didnt_work so i'm use the internet_browser to run video so all in all just dont get the_app just use_safari or another internet_browser;<br>2: ive try on three separate account and it hasn't work;<br>3: we can't_play video it's say there's_an_error but i get good_wifi all_my other_apps that require wifi work;<br>,10
topic5,2.044197,internet browser; multiple time; last time,0,11.49,1: ever_since_the update it's either load or tell_me i have_no_connection but all_my other_apps load and connect;<br>2: everytime youtube update i_cant_watch video it_doesn't show the buffer bar and just_stay freeze;<br>3: every_time_i look to_see a reply or maybe a comment from my_notification the video that show the comment never_load and end_up have a load error;<br>,11
topic5,1.788039,party apps; wont load; pause button,0,12.03,1: i_hate the new way the video work it feel so odd;<br>2: most if not all the time video wont_load when they can work in 3rd party_apps;<br>3: i would very much like to be_able_to move the video slider so i_can skip_ahead in a_video rather_than spend most_of_the video try_to actually click the slider;<br>,12
topic5,1.532100,wrong tap; wont play; dosent work,0,12.04,1: i_can no_longer watch youtube video on_my_phone fix_it or i will delete the_app;<br>2: i_can no_longer view the list_of video from channel_i'm_subscribe to since_the latest_update;<br>3: since_the last_update i get too_many_ad during video stream this be crazy;<br>,13
topic5,2.781376,last time; full screen mode; say error,watch vids; spring day; last time,12.05,1: i use to spend lot_of time on youtube but with the_new_update i_can't log_into my_account when_i do try_to log_in it express an_error that i do_not know_how to fix;<br>2: it fricking freeze whenever_i_click_on the_app no_matter if i remove it from recently use;<br>3: i have not_be_able to use this_app since november because every_time_i open it just crash;<br>,14
topic5,1.560798,load circle; side bar; many time,0,12.06,1: i_love_youtube but whenever_i_click_on a_video it_say_error tap_again or try later everything work even the comment and all that except the video;<br>2: i_can always tell when this_app have be update even before i check because video just_stop work and i get a something_go_wrong_tap to_retry message;<br>3: it won't_play the video i_click_on it but it_doesn't play so trash bruh;<br>,15
topic5,1.890198,third party; stop work; next time,0,12.07,1: i don't get it when before it use to be_great but_now it get_worse by the minute with_each new_update;<br>2: but seriously_guy the something_go_wrong_tap to_retry screen be get on my last nerve;<br>3: can not get anything to load;<br>,16
topic5,2.740541,useless feature; lgbt community; scrub bar,0,12.09,1: i use to think it be the app's fault but see as i_can't_watch some video on_facebook twitter nhl and various other_apps i don't think_it's youtube's fault that we still_can't_watch video;<br>2: i_can download the video from youtube and watch offline when_i travel to malaysia but i_can do it in singapore;<br>3: i_cannot even stomach use youtube while you pretend be an ally and do this to lgbt creator and the lgbt_community itself;<br>,17
topic5,1.974008,useless feature; error message; keep get,0,12.10,1: you would think_they would have employ a designer that actually finish school;<br>2: since_the new_update i_can't_watch anything it_keep_say oups something_go_wrong it happen at my school so i_think it be the wifi but it do it even_when i'm use my_wifi;<br>3: i_can't_watch anything because_of this stupid_update;<br>,18
topic5,1.590357,web browser; background play; bug fix,0,12.11,1: you_guy have one job make a work app be you_guy even try;<br>2: basically any_video that i watch on_io have the like and dislike disable but if i go_on the pc version it still work;<br>3: never think i would be say this but;<br>,19
topic6,1.465801,audio keep; keep get; billion dollar,0,11.30,1: every_video get a_few_minute in and hiccup cause the audio and video to go_out_of sync;<br>2: on most video i watch the audio be out_of_sync and the description be completely go and sometimes the comment be go as_well please_fix so buggy;<br>3: all video i watch be jittery and the audio get_out_of sync;<br>,1
topic6,1.445197,long time; audio continue; say error,0,11.34,1: i be watch the_same video but then it play a random video that have nothing to do with what i be watch;<br>2: i have fast internet and it buffer for ever the video never_load;<br>3: <digit> <digit> <digit> this_app no_longer_play video it only play advertisement it show various advertisement then when it be time for the <digit> and only video to load it give an_error and play another ad;<br>,2
topic6,2.730219,full screen; playback error; main thing,full screen; playback error; connection error,11.35,1: hi i be wonder_if you_could install a refresh button because sometimes even_if i'm_connect_to wifi it_say that i'm offline;<br>2: when_i watch_a old live_stream it_take me to the newest live_stream that be offline and when_you press the subscription button it doesn t work why;<br>3: youtube be_fine before this update now subscription won't_load when_you press them and comment be really screw_up;<br>,3
topic6,1.283618,get stick; live stream; wont work,get stick; wont work; bug fix,11.38,1: but it when your video freeze at the start of the video and not move;<br>2: if i watch_a video it wont_work it just_sit_there freeze hel;<br>3: whenever_i_try and watch_a video it get_stick on the first second not_even advertisement will_play;<br>,4
topic6,1.360998,multiple time; pause button; channel art,0,11.39,1: as others have say video load_but won't_play;<br>2: the video would load_but it wouldn't ever start play;<br>3: every_time_i go_to watch_a video it load_but never_play i've_try with both wifi and 4g still_doesn't_work please_fix_this as it be worldly perfectly a view day_ago;<br>,5
topic6,1.501034,keep freeze; find anything; ipad air,0,11.41,1: it only say watch till you've watch the full video;<br>2: the new view_all reply feature be a_complete fail on_ipad you view the reply then you cannot return_to where_you be if i've scroll halfway down view reply it_take me to top_of page real annoy it work for a tiny bite now doesn't and youtube why_do_you constantly play and loop video i don't_want_to watch it's instrusive;<br>3: when your use wifi you_can select the quality of the video you be watch but when you're on your_own data you_can't and that really chew up your data sometimes cause it will_load it in_full resolution;<br>,6
