key,value,label,emerlabel,version,sent1,num
topic0,1.363217,subscription page; many time; audio keep,0,11.30,1: the fade filter place on watch video also show_up on other that have not be watch in subscribe video;<br>2: almost_all the time video will_not_load on my_wifi while other_apps do i_can also see the thumbnail when this_happen and all seem_to_be work until the video_won't_load;<br>3: the subscription_page seem_to have fade thumbnail the_same as watch video except without the watch indication on it;<br>,1
topic0,1.738095,comment section; web browser; use safari,0,11.34,1: change the comment style back as_well;<br>2: so i be on youtube this_morning and i saw the youtube comment be different and it be almost impossible_to figure_out what do what;<br>3: fix the comment plz can't_even tell the difference_between comment and reply and everything_else you do in the update scrap it and start over plz;<br>,2
topic0,2.141365,many people; top comment; subscription section,0,11.35,1: it be also glitchy as it only show most_recent comment and not top_comment even_when select;<br>2: i really do enjoy use this_app but in the_latest_update it have be really buggy_as i_can not select on the channel in_my_subscription it instead take to my_subscription_box with all_my channel i subscribe_to;<br>3: i find the current_version of this_app to be rather glitchy;<br>,3
topic0,1.767058,take age; bring back; get stick,take age; bring back; bug fix,11.38,1: not_only will it not let_me load the video i_want_to watch the ad at the beg won't_even load;<br>2: every_time_i want_to_watch a_video the ad load perfectly but not the_actual video if i_want_to watch the_actual video i would have to wait_for about a minute just so it could start and_then it'll buffer until it finish;<br>3: thumbnail and ad load fine_but video don't at_all;<br>,4
topic0,1.435363,social medium; use safari; cant see,0,11.39,1: and also give_us a way_to change thumbnail on_io or_at_least a quick way_to get to desktop mode;<br>2: thumbnail only show_up as a grey colour;<br>3: i've_try_everything to fix_it but the thumbnail aren't show_up;<br>,5
topic0,1.540172,long time; keep get worse; ipad air,0,11.41,1: this have really change the way i use this_app negatively;<br>2: i have use this_app for very long_time but_now i_cannot even use the_app as it cannot load my_account even i switch account it still_can't load;<br>3: i_love so_much this_app thank_for google to develop this wonderful app i never use any other_apps like this;<br>,6
topic0,1.536113,revert back; use safari; home page,0,11.43,1: please_bring it back_to the way it use to look the_previous_update be_fine_but this one really put me in a bad mood;<br>2: the swipe tab be_very easy then move ur finger all the way_down;<br>3: please return_to the design where the tab be at the_top it be a much sleeker more modern look app than it be now;<br>,7
topic0,1.663158,keep write; side bar; keep crash,0,11.45,1: i_don't_like it because i've be so use to the tab icon be at the_top and now it's be move to the_bottom it's also harder_to see them because_they aren't red anymore and they hide with the_background colour color which_be white;<br>2: the_bottom tab selection be_horrible move it back_to the way it be which_be at the_top;<br>3: in it current condition this_app be_terrible;<br>,8
topic0,1.934621,scrub bar; skip forward; double tap,0,11.47,1: you_guy need_to remove the button altogether or locate them somewhere other_than the screen;<br>2: when watch_a video in_full_screen_mode under the scrub_bar there_be recommend video which pop_up onto the screen if_you even accidentally touch the damn screen also scrub be a_pain with the recommendation pop_up instead_of let_me scrub remove this;<br>3: also since i'm a_youtuber and i don't have a_computer i_can't do thumbnail or stuff you_can only do on the computer;<br>,9
topic0,1.599522,data usage; cellular network; keep press,0,11.47.1,1: this work a_couple_of day_ago also oddly enough video won't_even load when use web base youtube on_safari;<br>2: even i_try use web_version also no use;<br>3: i use the_app daily and it be work_perfectly but suddenly my_subscription bar doesn't_load anymore;<br>,10
topic0,1.888676,make sense; error message; keep get,0,11.49,1: but it_still_doesn't work so what's the use of have this useless app;<br>2: however when_i use youtube in the browser it work flawlessly;<br>3: it use to work but_now for_some_reason it_doesn't_work;<br>,11
topic0,1.557291,skip thing; rewind button; stop work,0,12.03,1: it use to be easy control buffer bar;<br>2: the control be clunky and hard_to use;<br>3: find an alternative way so that we_can still use this feature;<br>,12
topic0,2.744303,double tap; keep press; scroll bar,0,12.04,1: listen i_love_youtube good_job on keep the system up and run awesome also can_you remove that double_tap leave and right on the screen to go forward in the_latest_update please it annoy_me when_i hit it by_accident and please_make so that when the screen go dim can_you please_make that not happen until like 30minutes please that's_all and thank_you_for read this keep up the good work;<br>2: the_app use to work but_now video take around 5_minute to load and a black load screen will overlay which_be a_bite annoy;<br>3: also i keep_press the like button but it accidentally make me want_to comment on the comment;<br>,13
topic0,1.801976,full screen mode; spring day; last time,0,12.05,1: h this start today when_i be look on my_subscription video and the thumbnail be literally all distort and glitchy lot_of odd white stuff everywhere on the thumbnail please_fix it;<br>2: look_like whomever design the ui need_to be replace with someone_who understand modern interface design and can_see beyond the exist issue;<br>3: also change your name to addtube;<br>,14
topic0,2.785262,spring day; keep get; terrible layout,0,12.06,1: why_do_you consistently change aspect of the_app that be work completely fine_but then mess them all up just for the sake of change;<br>2: the forward rewind dot have also be move way at_the_bottom make it hard_to forward_or rewind it;<br>3: if_you cast a_video via youtube to your chromecast then open another app such_as instagram or snapchat change volume via volume rocker on your iphone will also change the volume of the video even_if youtube be minimize;<br>,15
topic0,1.890198,stop work; third party; next time,0,12.07,1: use to work not anymore;<br>2: use to work but after_update it will_load the ad but won't_play them result_in me not_be_able to watch_any_video;<br>3: only work rarely when it use to work_perfectly;<br>,16
topic0,1.917547,nothing work; useless feature; many people,0,12.09,1: i use to love the_app but_now i_can no_longer watch_any_video cause of bug;<br>2: and now i_can't use the_app at_all;<br>3: i bet you won't_even read any review from your_user because you care so_much about the money make from add advertisement to the_app but why_can't you just add a 5_second_skip button to every ad and also put an_ad_at every_single_video;<br>,17
topic0,1.602183,ipad mini; useless feature; background playback,0,12.10,1: i_hate accidentally_click the button then have to remove the_app from my_tv;<br>2: the_app crash_a_lot and when it dose not it really_slow just need some stability btw i use an ipad_mini;<br>3: so please_fix_this so i_can actually use the_app;<br>,18
topic0,1.884099,watch anything; web browser; stupid message,0,12.11,1: we_can barely watch_anything on this_app without a stupid_message block our_way;<br>2: so the notification hub be a bother as i don't get email from youtube but google now and that's crap have to change email filter and there_be_no clear way_to disable in app response to just go_back_to your email;<br>3: this_app doesn't_work and if_you go_on to youtube on the web_browser it_doesn't_work either;<br>,19
topic1,1.585402,right hand; billion dollar; keep crash,0,11.30,1: in the_last_few day since_the latest_up date a_video will_play for_a_few minute and_then all_of a_sudden without_me touch any_video change to another in the list;<br>2: all without_me touch any vid other_than the first one choose and none p age right through;<br>3: i watch_a video which make reference to nba and all i a_sudden my youtube recommend be full of nba highlight;<br>,1
topic1,1.471207,long time; say error; web browser,0,11.34,1: there a_bug_where when_i zoom into a_video and cant zoom back out and when_i click_on_a channel in_my_subscription it doesnt open;<br>2: every_time_i try_to go_to someone's youtube channel it_doesn't_let me and it keep go_back_to all channel and i have to click a_couple more time until i'm_able_to fully view just one person's channel;<br>3: this update be crazy the comment be_horrible and when_ever i press view_all reply it_take me to a completely different place;<br>,2
topic1,2.083384,right hand; auto play; subscription page,auto play; right hand; major problem,11.35,1: in the_last_few day since_the latest_up date a_video will_play for_a_few minute and_then all_of a_sudden without_me touch any_video change to another in the list;<br>2: can't_even load video why not make it so that we can't_watch video great_idea;<br>3: this make it harder_to close and_reopen a_video to force skip unskippable_ad that be 30_second long;<br>,3
topic1,1.223582,bug fix; get stick; bring back,0,11.38,1: seem_to me a_lot_of people now can't_watch video due_to a bug include myself;<br>2: must_be a glitch or a bug;<br>3: after the update i_can't seem_to play the video and thats so_frustrate cuz youtube isn't some small company and bug like this should_be immediately fix;<br>,4
topic1,0.996984,slide bar; rewind button; social medium,0,11.39,1: problem_with_this app be every_time you open a_new mpg the_app change setting to auto which_be 1080dpi chew up all_of your data this be so_stupid because i doubt iphone_or ipad even_support <digit> i_can't see the difference_between 480dpi and any higher i've write to utube assistance on <digit> occasion now and not one reply the setting should stay as you set them not do as they please;<br>2: youtube's video recommendation make as_much sense as <digit> <digit>;<br>3: i rat this_app for 1_star only cauz these update make no sense at_all make it more worse;<br>,5
topic1,1.348419,home button; full screen; channel art,0,11.41,1: why_do u make it <digit> i watch nothing violent just sometimes put it to <digit>;<br>2: i waste to much safari internet cause i watch yt like <digit> <digit>;<br>3: it only stay_on <digit> min and <digit> sec;<br>,6
topic1,1.318868,next time; cellular data; home page,0,11.43,1: the_new_update make the_app so slow and it crash so frequently that i just think_it's honestly a waste_of time;<br>2: the_new_update generally make the_app worse;<br>3: so disappoint the_new_update make it that the video_won't_play at_all so now i delete it and be hop that it'll get fix next_time i get it;<br>,7
topic1,1.069275,something wrong; live stream; side bar,0,11.45,1: even_though people don't_like the_new_update i still think_it's a_great app before and still be a awesome app to_watch your vids and even make your_own so i don't_mind it;<br>2: please_fix it banner and profile picture make a channel good;<br>3: i like the_fact_that i_could view a vertical footage fullscreen without have to go horizontal and see <digit> 3rds of black;<br>,8
topic1,1.282482,mise jour; try delete; pathetic effort,0,11.47,1: depuis <digit> semaines je n'arrives pa regarder de vid_os sur youtube et pourtant ma copine qui a le m_me t_l phone que moi y arrive sans probl me;<br>2: should have make this_app to require io <digit> because most people don't have newer phone and can't afford them;<br>3: and also_why would you make youtube <digit>;<br>,9
topic1,1.879463,drain battery; keep say; free trial,0,11.47.1,1: it's be more_than <digit> month now and still_can't_watch a_single_video at_all;<br>2: app up to date <digit> <digit> <digit>;<br>3: so i delete your_app i_know <digit> people i talk to in twenty min do the_same;<br>,10
topic1,2.232175,multiple time; watch vids; offline mode,0,11.49,1: i be try_to make new account for youtube i push more option and_then try_to add an_account but i accidentally put the wrong year_and it think i be underage for youtube;<br>2: i have try multiple_time to make youtube work but it won't no_matter_how_many time i delete and_re_download it just won't_work change something;<br>3: ya think that something may_be wrong faggot;<br>,11
topic1,1.374382,stop change; full screen; audio continue,0,12.03,1: the_new_update make it look_like trash;<br>2: they're try_to make it <digit> like you're on a_computer but it can't run as_well anymore;<br>3: can_you_guy stop focus_on make layout change add thing that we_don't need and actually improve the performance of the_app;<br>,12
topic1,1.746767,important thing; many bug; home page,0,12.04,1: awful update video_won't_load the new system for change video time point be awful 10_second be too_long to skip_back for a_small thing and too short to skip_back a_bite it's the worst middle grind possible plus now the new placement and smaller size_of the video time make it super hard_to move around and it jump from place to place oddly just go_back_to the version with important_thing in black and that side and such it be better pls_fix google and actually communicate with your_user;<br>2: why must you make bad_update u fix many_bug and earn a 5_star from me a_couple month_ago the annoy one where yt kick u out <digit> min into vid u fix_it and i be happy i suggest u fix these remain bug and any_other stupid thing and just let_us enjoy youtube also the new_feature where if_u tap_on leave or right side it_take u 10_sec ahead or back be_really_annoy;<br>3: basically make everything slower significantly and make the view worse;<br>,13
topic1,1.899989,full screen; nothing happen; last time,0,12.05,1: look_like whomever design the ui need_to be replace with someone_who understand modern interface design and can_see beyond the exist issue;<br>2: they're try_to make it <digit> like you're on a_computer but it can't run as_well anymore;<br>3: this_app continue_to push beyond the barrier of crappy_update;<br>,14
topic1,2.260448,terrible layout; grey screen; spring day,0,12.06,1: this have be an_option that people have want for so_long and the_fact_that we_have to have youtube_red be so sad;<br>2: who on earth think that remove people actually subscription from the_app be a_good idea;<br>3: one_of the most annoy thing that happen be even_though my_wifi be work_perfectly normally youtube say_something_go_wrong tap_to_retry it do this constantly and i always_have to shut_down and restart_my_ipad;<br>,15
topic1,1.959847,fix something; wont load; billion dollar,0,12.07,1: the_new_update generally make the_app worse;<br>2: why_do_you keep make the_app worse;<br>3: every update they do only make the_app worst;<br>,16
topic1,2.690704,live stream; useless feature; lgbt community,0,12.09,1: youtube need_to make this_app better again;<br>2: except you don't see us as people like you and you make that clear;<br>3: only the_new_update have make my youtube come to this;<br>,17
topic1,1.899693,error message; wont let; background playback,0,12.10,1: whenever_i_click_on a_video it would buffer and say_something_go_wrong tap_to_retry;<br>2: when_i press a_video be say_something_go_wrong tap_to_retry so i tap and it play for_about 20_second before the message_come_up again;<br>3: no video will_play it only say_something_go_wrong tap_to_retry;<br>,18
topic1,1.532918,background play; bug fix; keep get,0,12.11,1: please_fix_this or make a better youtube app;<br>2: plus it will make youtube feel and look better;<br>3: wow youtube video i_love watch_them and_then youtube just make it better and better;<br>,19
topic2,1.556543,long time; get stick; keep crash,0,11.30,1: that one glitch that really_annoy_me last_update will be go but a whole slew of new issue will arise;<br>2: that one glitch that really_annoy_me last_update will be go but s whole slew of new issue will arise;<br>3: every_time_i see a_new youtube io update my body fill instantly with joy;<br>,1
topic2,1.591228,web browser; use safari; make sense,0,11.34,1: aug <digit> title annoy rat 2_star i'm go_to have to remove this_app it can't do everything that a browser can so why it keep try_to open the_app instead be_ridiculous;<br>2: every_time_i try_to go_to someone's youtube channel it_doesn't_let me and it keep go_back_to all channel and i have to click a_couple more time until i'm_able_to fully view just one person's channel;<br>3: doesn't_help when the website try_to stop me and try_to open the_app instead;<br>,2
topic2,2.383475,comment thread; main thing; keep write,0,11.35,1: you_can't type a_message and interact with the_app withou be ask to discard the comment the_comment_section now lack so_much information that_you_can barely see more_than on thread and you_can no_longer reply directly to people in a comment_thread;<br>2: the_comment_section be poorly_design as i'm_not able_to reply_to some comment as the reply tab doesn't_show_up;<br>3: main_thing be let_us press the subscription and they will_load fix the comment so_we_can tell the difference_between comment and reply and so_we_can reply_to reply;<br>,3
topic2,1.526901,subscription list; take age; bug fix,subscription list; take age; bring back,11.38,1: s plz give option_to skip all add longer then 5_second or_at_least all 30_second_ad iv have to resort to watch_vids_on safari not_impress;<br>2: when_i go_on it just_say tap_to relode and when_i do it just_tell_me to it over and over plz_fix now;<br>3: sorry to youtube for mi blame;<br>,4
topic2,1.435363,social medium; use safari; cant see,0,11.39,1: i_can then reply_to your reply from my_first reply_to your reply and_then you_can re_reply so i_can re_reply to your re replay and_then we_can become life time friend because we_have reply and re_reply all_day long;<br>2: i_can_only give it one_star because i_can't reply_to reply_to a reply_to a reply_to a reply_to a reply or even_worse still i_can't reply_to a re_reply;<br>3: ooh my_life be so fulfil because_of reply_to a reply and;<br>,5
topic2,1.375924,find anything; search history; offline mode,0,11.41,1: why_do_you need_to go_to a_different page to read the comment reply;<br>2: recent downdates they sure as_hell ain't update when_you tap_on a comment it instantly go_to reply_to it so when_i try_to scroll_through the comment a reply come_up out_of nowhere;<br>3: when_you get to the comment you go_to another_page when_you try_to see the reply;<br>,6
topic2,1.519839,reply box; keep write; download quality,0,11.43,1: it just go_to the ad the ad never_play and the skip in <digit> sec never count down;<br>2: ad after ad after ad after ad after ad after ad after ad after ad after ad after ad;<br>3: write_a comment minimise keyboard click comment field to evoke the command and select keep_write;<br>,7
topic2,1.128853,portrait mode; whats wrong; full screen,0,11.45,1: when_i try_to play a_video it click it but only go 1_second in then freeze;<br>2: when_i turn_my_phone from landscape to portrait_mode when_i'm do with a_video it sometimes stay in_landscape but only half_of the screen;<br>3: every_time_i try_to play a_video on phone and ipad it will_not_work;<br>,8
topic2,1.526335,scrub bar; wont work; wrong tap,0,11.47,1: i use to love_youtube however this last_update add a feature that_you_can double_tap_to skip or rewind 10_second and it's do it when_i'm try_to exit a_video;<br>2: flood with add get beyond the joke the one where_you_can skip after 5sec be_fine_but the <digit> 30sec add be a head fck also how_do you see where_you comment on a_video;<br>3: i be not get anything where my suggestion should_be the occasional add will pop_up there but no suggestion;<br>,9
topic2,1.572552,keep write; comment section; subscription fee,0,11.47.1,1: when_i try_to like a comment it usually pull up the keyboard and when_i want_to cancel it discard the reply and after a long delay it cut to a_message ask_if i would_like to discard my_comment;<br>2: when_i access the edit field in_order_to add a comment to any_video there_be an unlabeled button;<br>3: when decide against write_a comment i_click cancel and at time the white box even empty of write be still there block comment and half the lower page;<br>,10
topic2,2.064896,download quality; default download quality; full screen,0,11.49,1: when_i download a_video it let_me choose the download_quality but automatically_select this as the default_download_quality for future download mean i have to go_through setting and re select ask each_time;<br>2: ok_so the new_share system suck like when_i try_to get a link and paste it to a download app it_doesn't_work because that's not the link;<br>3: when_i remove a_video from a_playlist add a_video to a_playlist subscribe_to a channel etc the black notification box at_the_bottom block access to the_option_menu for any_video that's at_the_bottom of the page;<br>,11
topic2,1.140734,subscription fee; full screen; wont load,0,12.03,1: the_last_update didn't_work so please get it fix cause i'm do with this_app;<br>2: new developer be need_to get a_fresh perspective on all the problem_with_this app;<br>3: how_about we get ipad picture_in_picture already;<br>,12
topic2,2.079437,ipad mini; comment thread; exit full screen,ipad mini; comment thread; major problem,12.04,1: this doesn't mean much since i_can't_watch anything in there or anywhere else for that matter every_single_video i_try to view flip into a_black_screen with an_error_message announce it couldn't be view;<br>2: now every_single_video i go_to watch say_something_go_wrong i_click to reload and keep receive the_same error;<br>3: the one that bug me the most recently be that after i exit_full_screen my_subscription list go way_to the_top but not completely;<br>,13
topic2,1.820664,watch vids; full screen mode; spring day,0,12.05,1: i_can't get a_single_video to play after the_last_update;<br>2: you think it cant get any worse_than this;<br>3: everything be hard_to get too and the layout be a_mess;<br>,14
topic2,2.217629,mise jour; fix something; many time,mise jour; fix something; home button,12.06,1: i be unsubbed from all_my favorite channel all_my watch_later vids go all_my playlist go subscribe_to people i unsubscribed to a year_ago;<br>2: le pub ont ne peut m_me plus le passer et j'ai perdu mon compte youtube et impossible_de le r cup rer;<br>3: d us de cette mise_jour tout perdu me vid_o me pr f rer et me abonnement;<br>,15
topic2,1.840749,get stick; ipad air; single video,0,12.07,1: i_can't reply_to any comment without it crash;<br>2: other bug be prevelant such_as the comment not show_up right_away;<br>3: if_you load the comment on a_video and_then tap_on view_all comment the_app instantly crash;<br>,16
topic2,2.228998,restrict mode; many people; stupid message,0,12.09,1: you get your jolly by pick on us canadian;<br>2: im now stick_on the browser think of how crappy youtube be get;<br>3: that's_all i'm get and i'm_sick_of it;<br>,17
topic2,1.976299,wifi connection; useless feature; keep say,0,12.10,1: when_i access the edit field in_order_to add a comment to any_video there_be an unlabeled button;<br>2: also when_i scroll_down at_the_bottom comment it buffer it's_not mild buffer but it's infinite buffer;<br>3: now when_i go_to reply_to a comment it always put the thread creator name in instead_of the person i'm reply_to;<br>,18
topic2,1.848164,relate video; watch anything; stupid message,0,12.11,1: no ability_to refresh a page no comment view no relate_video;<br>2: we_can barely watch_anything on this_app without a stupid_message block our_way;<br>3: certains moment on est incapable de faire lira une vid_o;<br>,19
topic3,1.556543,many time; long time; get stick,0,11.30,1: i spend a_lot_of time on youtube and a_lot_of that time be spend listen_to_music;<br>2: frequently get play back error and can't be fix even on good_wifi also when_i try_to rotate the screen it don't rotate many_time it's_annoy after a_while;<br>3: audio be out_of_sync most_of_the time when the_app try's_to fix itself the video go fuzzy for a_while;<br>,1
topic3,1.586465,say error; web browser; use safari,0,11.34,1: these new rule be idiotic every_time_i go_on one_of my subscribe youtubers on there video it_say im go_to quit youtube why_can't youtube just go_back_to the way it be it be way more fun now i_can't enjoy youtube anymore;<br>2: i'm give you one last chance you_tube u don't_work i'm go_back_to watch it on_safari;<br>3: i attempt_to view_any_video all i get be a_message at_the_bottom that say_error while load video what's the_point_of have youtube if_you cannot_even view anything in_my_subscription;<br>,2
topic3,1.926336,subscribe channel; several time; sub box,0,11.35,1: youtube be such_a good_app for device but the_newest_update make it not the_best when_i try_to click_on_a channel in the subscribe bar it_doesn't go_into there channel so i have to search up there channel and it_take more time;<br>2: when_i click_on_a channel in_my_subscription i have to tap_on it several_time for it to actually get onto the channel;<br>3: when_i click a channel it won't_show there page;<br>,3
topic3,1.466969,take age; bring back; get stick,0,11.38,1: it's_really get annoy and on my nerve;<br>2: the quality be horrendous even ad now be in poor quality video take_age to load and even longer to load 720p focus less on add new_feature and more on fix the one we've get seriously youtube get a grip;<br>3: i_try delete the_app and download it again but it didn't fix anything;<br>,4
